id,estc,stc,title,authors,publisher,pubplace,subject_headings,date
A21069,S1911,7435.5,"Information for the ignorant, or, The applicatory part of a late printed book, called, A light for the ignorant containing a few observations upon the I Cor. 10, which doe strongly prove it to be absolutely sinfull to heare the word preached in any false state, or assembly, whatsoever : also a postscript containing a challenge (layd down in 9. propositions) to all the Non-conformists in Old and New England, and Holland / made by N.E.",N. E.,Cloppenburg Press,Amsterdam,"Corinthians, 1st, X; Bible.; Dissenters.; Criticism, interpretation, etc.; N.T.",1640
A29744,R25301,B5022,"The vnerring and vnerrable church, or, An answer to a sermon preached by Mr. Andrew Sall formerly a Iesuit, and now a minister of the Protestant church / written by I.S. and dedicated to His Excellency the Most Honourable Arthur Earl of Essex ...",I. S.,s n,S l,Christian union.,1675
A21258,S100323,7610,"The complaint of a sanctified sinner answered: or An explanation of the seuenth chapter of the Epistle of Saint Paul to the Romans deliuered in diuers sermons. Preached by Edward Elton, Bachelour in Diuinitie, and preacher of Gods Word at Saint Mary Magdalens Barmondsey neere London. An now by him published, intending the common good and profit of Gods Church.","Elton, Edward, d. 1624.",Printed by W Stansby for Robert Mylbourne and are to be sold in Pauls Church yard at the signe of the Blacke Beare,London,Bible.; Commentaries.; N.T.; Romans VII,1618
A29121,R213087,B4136A,"The second Adam being the second part, or branch of the comparison between the first, and the second Adam, in these words, so by the obedience of one, shall many be made righteous. By Thomas Bradley doctor of divinity, chaplaine to His late Majesty King Charles the First, and præbend of York. And there preached at Lent assizes holden there, 1667/8. Oxon. Exon.","Bradley, Thomas, 1597-1670.",printed by Stephen Bulkley and are to be sold by Richard Lambert,York,Jesus Christ; Person and offices; Early works to 1800.,1668
A34785,R4524,C6622,"The Covenanters catechisme, or, A brief and familiar analysis and exposition of the Covenant first delivered in sundry sermons to a particular congregation : and now resolved into questions and answers for the more publike good / by the same avthor.",Anonymous,By John Raworth,Printed at London,Solemn League and Covenant (1643),1644
A37030,R214401,D279A,"A contemplation of mans mortalitie. Preached at Reading, by John Dashfield, M.A.","Dashfield, John.",s n,Printed at London,Man (Christian theology); Mortality; Early works to 1800.,1649
A33218,R23257,C4393,A reply to a pamphlet called The mischief of impositions which pretends to answer the Dean of St. Paul's sermon concerning The mischief of separation.,"Clagett, William, 1646-1688.",Printed for Walter Kettilby,London,"Stillingfleet, Edward, 1635-1699.; Alsop, Vincent, 1629 or 30-1703.; Dissenters, Religious; England.; Mischief of separation.; Mischief of impositions.",1681
A39910,R28411,F1484,"A discourse concerning God's judgements resolving many weighty questions and cases relating to them. Preached (for the substance of it) at Old Swinford in Worcester-shire: and now publish'd to accompany the annexed narrative, concerning the man whose hands and legs lately rotted off: in the neighbouring parish of Kings-Swinford, in Staffordshire; penned by another author. / by Simon Ford ...","Ford, Simon, 1619?-1699.; Illingworth, James, d. 1693. A just narrative or account of the man whose hands and legs rotted off.",Printed by A C for Henry Brome at the Gun at the West end of St Pauls,London,"Duncalf, John, d. 1677.; Providence and government of God.",1678
A30305,R34773,B5738,"The poor man's help and young mans guide containing I. Doctrinal instructions for the right informing of his judgment, II. Practical directions for the general course of his life, III. Particular advices for the well-managing of every day : with reference to his [brace] 1. Natural actions, 2. Civil imployments, 3. Necessary recreations, 4. Religious duties : particularly I. Prayer [brace] publick in the congregation, private in the family, secret in the closet, II. Reading the Holy Scriptures, III. Hearing of the Word preached, IV. Receiving of the Lord's Supper : unto which is added an earnest exhortation unto all Christians to the love and practice of universal holiness / by William Burkitt ...","Burkitt, William, 1650-1703.",Printed for Tho Parkhurst,London,Christian life.,1694
A38609,R217341,E3263A,"New observations upon the decalogue: or The second of the four parts of Christian doctrine, preached upon the catechism. By John Despagne Minister of the Gospel","Espagne, Jean d', 1591-1659.",printed by Thomas Newcomb for Joshuah Kirton and are to be sold at his shop at the sign of the Kings Arms in Pauls Church yard,London,"Essence, genius, nature; Early works to 1800.; Christianity; Christian ethics",1652
A37485,R41917,D898,"Two letters to Dr. Benjamin Calamy one in English, the other in Latine / by Thomas De Laune, upon his imprisonment in Newgate, for the answer given at the said Dr. Calamy's call, to his sermon entituled, A discourse about a scrupulous conscience, in a late piece called, A plea for the non-conformists, &c.","De Laune, Thomas, d. 1685.",s n,London,"Calamy, Benjamin, 1642-1686.; Discourse about a scrupulous conscience.; Dissenters, Religious; England.; Liberty of conscience",1683
A34979,R8981,C6916,"Christ alone exalted in Dr. Crisp's sermons partly confirmed in answering Mr. Daniel Williams's preface to his Gospel truth stated, by alledging testimonies from Scripture and the doctrine of the Church of England, in the Book of homilies establish'd by law and other orthodox authorities : shewing how he hath wronged as well the truth as the said doctor in the great point of justification by the Neonomian doctrine / humbly offer'd by S.C., an unworthy son of the said doctor, author of a book entituled, Christ made sin, reflected on by Mr. Williams.","Crisp, Samuel, 17th cent.",Printed for William Marshall and Henry Barnard,London,"Crisp, Tobias, 1600-1643.; Williams, Daniel, 1643?-1716.; Christ alone exalted.; Gospel-truth stated and vindicated.",1693
A36265,R33458,D1827B,"The reason why not infant sprinkling but believers baptism ought to be approved is because the Lord Jesus Christ, his forerunner, and apostles preach't it, and practic'd it as hereby will further appear by Scripture authority in about fourty texts, with notes on every text : to which is added, how infant sprinkling came in fashion, the evil tendencies of infant sprinkling, answers to objections, differences betw. believ. baptism and inf. sprink. with several other things / by a believer baptiz'd.","Doe, Charles.",s n,London printed,Baptism.; Controversial literature.; Infant baptism,1694
A38608,R13854,E3263,"New observations upon the Creed, or, The first of the four parts of the doctrine of Christianity preached upon the catechism of the French churches : whereunto is annexed The use of the Lords prayer maintained / by John Despagne ... ; translated out of French into English.","C. M. D. M.; Espagne, Jean d', 1591-1659.",Printed by Ruth Raworth for Thomas Whitaker,London,No Keywords,1647
A31039,R11565,B910,"The rector of Sutton committed with the dean of St. Paul's, or, A defence of Dr. Stillingfleet's Irenicum, his discourses of excommunication, idolatry, and other writings, against his late sermon entituled, The mischief of separation by the author of the Christian temper, in a letter to a friend.","Barret, John, 1631-1713.; Alsop, Vincent, 1629 or 30-1703.",Printed by J D to be sold by Richard Janeway,London,"Irenicum.; Mischief of separation.; Stillingfleet, Edward, 1635-1699.",1680
A68174,S104014,13269,"A briefe and moderate answer, to the seditious and scandalous challenges of Henry Burton, late of Friday-Streete in the two sermons, by him preached on the fifth of November. 1636. and in the apologie prefixt before them. By Peter Heylyn.","Heylyn, Peter, 1600-1662.",Printed by Ric Hodgkinsonne and are to be sold by Daniel Frere dwelling in little Brittan at the signe of the red Bull,London,"Burton, Henry, 1578-1648.; For God, and the King; Controversial literature.; Apology of an appeale",1637
A65701,R1639,W1724,"A discourse of the love of God shewing that it is well consistent with some love or desire of the creature, and answering all the arguments of Mr. Norris in his sermon on Matth. 22, 37, and of the letters philosohical and divine to the contrary / by Daniel Whitby ...","Whitby, Daniel, 1638-1726.",Printed for Awnsham and John Churchill,London,"Norris, John, 1657-1711.; God; Worship and love.",1697
A64635,R10033,U161,"Certain discourses, viz. of Babylon (Rev. 18. 4.) being the present See of Rome (with a sermon of Bishop Bedels upon the same words) of laying on of hands (Heb. 6. 2.) to be an ordained ministry, of the old form of words in ordination, of a set form of prayer : each being the judgment of the late Arch-bishop of Armagh, and Primate of Ireland / published and enlarged by Nicholas Bernard ... : unto which is added a character of Bishop Bedel, and an answer to Mr. Pierces fifth letter concerning the late Primate.","Ussher, James, 1581-1656.; Bedell, William, 1571-1642.; Bernard, Nicholas, d. 1661.",Printed for John Crook,London,"Bedell, William, 1571-1642.; Catholic Church; Controversial literature.",1659
A64394,R34652,T736,"Publii Terentii Carthaginiensis Afris poëtae lepidissimi comoediae sex Anglo-Latinae in usum ludi-discipulorum, quo Feliciùs venustatem linguae Latinae ad sermonem quotidianum exercendum assequantur / a Carolo Hoole ... = Six comedies of that excellent poet Publius Terentius, an African of Carthage, in English and Latine : for the use of young scholars, that they may the more readily attain the purity of the Latine tongue for common discourse / by Charles Hoole ...","Terence.; Hoole, Charles, 1610-1667.",Printed for the Company of Stationers,London,Latin drama (Comedy),1663
A66437,W15452,W2743,"Warnings to the unclean in a discourse from Rev. XXI. 8. Preacht at Springfield lecture, August 25th. 1698. At the execution of Sarah Smith. By Mr. John Williams pastor of the Church at Deerfield.","Williams, John, 1664-1729.",printed by B Green and J Allen for Michael Perry at his shop over against the Town House,Boston,"Christian literature; Repentance; Massachusetts; Executions and executioners; Smith, Sarah, d. 1698; Early works to 1800.",1699
A69662,R4327,B6162A,"A full and satisfactorie ansvvere to the Arch-bishop of Canterbvries speech, or, Funerall sermon preached by himselfe on the Tower-hill, on Friday the tenth of Ianuary, 1645, upon Hebr. 12. 1, 2 at which time he was there and then beheaded wherein is a full and plenary discourse to satisfie all those who have been startled with his suttle and Jesuiticall falacies and evasions in the said speech : and other passages and observations of great consequence, to satisfie the expectation of the Kingdome therein.","Burton, Henry, 1578-1648.",Printed by Jane Coe,London,"Laud, William, 1573-1645.",1645
A64178,R6037,T476,"Love one another: a tub lecture, preached at Watford in Hartfordshire at a conventicle on the 25. of December last, being Christmas day, by John Alexander, a joyner. His text was taken out of the epistle of Saint Iohn, and himselfe was taken by Captaine Bird, Lieutenant Rock, and other officers, from whom he received such usage as his doctrine did deserve; for which the said officers were commended by the Parliament.","Taylor, John, 1580-1653.",s n,London,"Religious aspects; England; Love; Dissenters, Religious; Early works to 1800.",1643
A66772,R12240,W3181,"A proclamation in the name of the King of kings, to all inhabitants of the isles of Great Brittain and especially to those who have hypocritically pretended to justice, mercy, honesty, and religion (as also to them who have lived in open prophaness and impiety) summoning them to repentance, by denouncing God's judgements, and declaring his mercy, offered in the everlasting gospel / warrantably proclaimed and preached by Geo. Wither ... ; whereto are added, some fragments of the same authors, omitted in the first imprinting of the book, intituled Scraps and crums, and a few which were collected since that impression, and during his imprisonment.","Wither, George, 1588-1667.",s n,London,"Great Britain; History; Puritan Revolution, 1642-1660; Wither, George, 1588-1667.; Poetry.",1662
A69511,R1013,A63,"Cheap-side Crosse censured and condemned by a letter sent from the vicechancellour and other learned men of the famous Vniversitie of Oxford in answer to a question propounded by the citizens of London, concerning the said crosse, in the yeere 1600, in which yeer it was beautified : as also a remarkable passage to the same purpose, in a sermon preached to an eminent and very great auditory in this city of London / by a very reverend, holy, and learned divine, a while after the crosse was last repaired, which was anno 1606.","Archer, John, Master of Art.; Abbot, George, 1562-1633.",Printed by A N for I R and are to be sold at his shop,London,"Cheapside Cross (London, England)",1641
A62878,R21407,T1827,"Væ scandalizantium, or, A treatise of scandalizing wherein the necessity, nature, sorts, and evills of scandalizing, are handled, with resolution of many questions thereto pertaining / preached at Lemster, in Herefordshire by Iohn Tombes ...","Tombes, John, 1603?-1676.",Printed by Leon Lichfield for Edward Forrest,Oxford,"Bible.; Luke XVII, 1-2; Criticism, interpretation, etc.; N.T.",1641
A76316,R201292,B1668,"An examination of the chief points of Antinomianism, collected out of some lectures lately preached in the church of Antholines parish, London: and now drawn together into a body, and published for the benefit of all that love the holy truth of God, / by Thomas Bedford B. D. Vnto which is annexed, an examination of a pamphlet lately published, intituled The compassionate Samaritan, handling the power of the magistrate in the compulsion of conscience: by the same author.","Bedford, Thomas, d. 1653.",Printed by John Field for Philemon Stephens and are to be sold at his shop at the sign of the gilded Lyon in Pauls Church yard,London,"Walwyn, William, 1600-1681.; Great Britain; 17th century; England; Antinomianism; Compassionate Samaritane unbinding the conscience; Church and state; Church history; Controversial literature; Early works to 1800.",1647
A77638,R206796,B5014,"The naked vvoman, or a rare epistle sent to Mr. Peter Sterry minister at Whitehall; desiring him to shew the causes or reasons of his silence, in that he neither by his ministeriall office, charged the magistrates that were present to redresse, nor so much as shewd any sign of grief or detestation, as became a sincere Christian; against that most strange ans shamefull late act of an impudent woman, in the midst of his sermon on a Lords day at Whitehall chapell, concerning the resurrection, before the chief states of this nation. A satisfactory answer he returned; which with a lving acceptance thereof, are here also printed; very worthy the observation of all, both sexes and degrees of people in these nations.","Brown, David, fl. 1650-1652.; Sterry, Peter, 1613-1672.",printed for E Blackmore at the Angel in Pauls Church yard,London,"Religion; Naked woman, or a rare epistle to sent to Mr. Peter Sterry minister at Whitehall.; Brown, David, fl. 1650-1652.; Early works to 1800.; Sterry, Peter, 1613-1672.",1652
A70157,R223664,G290,"A just defence and vindication of Gospel ministers and Gospel ordinances against the Quakers many false accusations, slanders and reproaches. In ansvver to John Horwood his letter, and E.B. his book, called, A just and lawful tryal of the ministers and teachers of this age, and several others. Proving the ministers calling and maintenance just and lawful, and the doctrine of perfection by free justification, preached by them, agreeable to the scriptures. VVith the Quakers objections answered. And the Quakers perfection by hearkning to, and obeying a light within them, proved contrary to the scriptures. And their practices in ten particulars proved contrary to the commands and examples of Christ and his apostles. By a lover of gospel ministers and gospel ordinances.","Gaskin, John, fl. 1660.",printed by W G for the author and are to be sold by Isaac Pridmore at the signe of the Golden Falcon neer the New Exchange,London,"Quakers; Society of Friends; Burrough, Edward, 1634-1662.; Just and lawful trial of the teachers & professed ministers of England, by a perfect proceeding against them; Controversial literature; Early works to 1800.",1660
A78013,R206611,B6143,"An individuall letter to every man that calls himselfe a minister of Jesus Christ. Penned more particularly for Mr. Christopher Love, upon some observations from his sermon, preached Jan. 29. 1644. at Windsor, and re-preached at Uxbridge, Jan. 30. 1644. upon Jer. 33. 6. Whereby the author doth examine and enquire, whether Master Love were ever called by God, and Jesus Christ, or directed by the spirit of truth to preach the said sermon: or ever sent forth by Jesus Christ to be his minister. Being also for a caveat or memento to all others who call themselves Christs ministers, to examine whether ever they had a mission or commission from Jesus Christ so to doe, the having embroyled the land of our nativity in an unnaturall warre formerly one with another, contrary to any command, precept, or practises of Christ and his apostles, or word of truth: by whose evill practises they have caused the gospel of truth and peace to be evill spoken of, and have opened a torrent of blood, which none but the heavenly physitian can stop and cure; to whom the author intreateth the people to looke, and pray, and waite for help, for vain is the help of man. Written by an English man, Christs servant, for Englands remembrance.","Burt, Nathaniel, fl. 1644-1655.",s n,London,"Lay preaching; Clergy; Early works to 1800.; Love, Christopher, 1618-1651.",1651
A77497,R200258,B4712,"The doctrine and practice of paedobaptisme, asserted and vindicated. By a large and full improovement of some principall arguments for it, and a briefe resolution of such materiall objections as are made against it. Whereunto is annexed a briefe and plaine Enarration, both doctrinall and practicall, upon Mark 10.V.13.14.15.16. As it was some time since preached in the church of Great Yarmouth: now published for an antidote against those yet spreading errours of the times, Anabaptisme and Catabaptisme. / By Joh. Brinsley.","Brinsley, John, 1600-1665.",Printed for Charles Greene and are to be sold at his shop in Ivie Lane at the signe of the Gun,London,Early works to 1800.; Infant baptism,1645
A50162,W479520,M1153,"Small offers towards the service of the tabernacle in the wilderness four discourses accommodated unto the designs of practical godliness : preached partly at Boston, partly at Charleston / by Cotton Mather ; published by a gentleman lately restored from threatening sickness as a humble essay to serve the interest of religion, in gratitude unto God for his recovery.","Mather, Cotton, 1663-1728.",Printed by R Pierce sold by Jos Brunning,Boston,Piety.; Christian life.; Spiritual life.,1689
A59900,R21027,S3371,A vindication of Dr. Sherlock's sermon concerning The danger of corrupting the faith by philosophy in answer to some Socinian remarks / by William Sherlock ...,"Sherlock, William, 1641?-1707.",Printed for W Rogers,London,"Socinianism.; Faith; Danger of corrupting the faith by philosophy.; Sherlock, William, 1641?-1707.; Early works to 1800.",1697
A47136,R218958,K158,"Divine immediate revelation and inspiration, continued in the true church second part. In two treatises: the first being an answer to Jo. W. Bajer Doctor and Professor of Divinity, so called, at Jena in Germany, published first in Latine, and now in English. The second being an answer to George Hicks, stiled Doctor of Divinity, his sermon preached at Oxford, 1681. and printed with the title of, The spirit of enthusiasm exorcised; where this pretended exorcist is detected. Together, with some testimonies of truth, collected out of diverse ancient writers and fathers, so called. By G.K.","Keith, George, 1639?-1716.",s n,London,"Revelation; Spirit of enthusiasm exorcised; Baier, Johann Wilhelm, 1647-1695; Hickes, George, 1642-1715.; Early works to 1800.",1685
A44843,R19160,H3230,"The record of sufferings for tythes in England the sufferers are, The seed of God, or, The assembly of his first-born, or, The first fruits unto God in England, in this age, who are called to be faithful, and have been found faithful, therefore have we suffered willingly the spoiling of our goods, for to us the truth is more precious then our estates, lives, or outward liberties, and thererfore hath the Lord accounted us first worthy to suffer for his name sake, and to be as lights in this deceitful generation : those which our suffering is a testimony against, is that priesthood which is light and treacherous, which in all ages the Lord raised up faithful witnesses against : ... : and in these dayes we may say, that they are worse then any troop of robbers, or any that preached for hire that ever went before them, as will appear in this book following, by their devouring vvidovvs houses spoiling mens goods, and destroying mens persons / given forth from those whom the Lord regards, who do tremble at his word, for which cause we are in scorn called Quakers ...","Hubberthorn, Richard, 1628-1662.",Printed for Tho Simmons,London,Tithes; England.,1658
A47903,R22008,L1286,"The Presbyterian sham, or, A commentary upon the new old answer of the Assembly of divines to Dr. Stillingfleet's sermon","L'Estrange, Roger, Sir, 1616-1704.",s n,London,"Westminster Assembly (1643-1652); Stillingfleet, Edward, 1635-1699.",1680
A44308,R28683,H2608,"The non-conformists champion, his challenge accepted, or, An answer to Mr. Baxter's Petition for peace written long since, but now first published upon his repeated provocations and importune clamors, that it was never answered : whereunto is prefixed an epistle to Mr. Baxter with some remarks upon his Holy Common-wealth, upon his Sermon to the House of Commons, upon his Non-conformists plea for peace and upon his Answer to Dr. Stillingfleet. / by Ri. Hooke.","R. H. (Richard Hooke); Baxter, Richard, 1615-1691. Holy commonwealth.; Baxter, Richard, 1615-1691. Petition for peace.; Baxter, Richard, 1615-1691. Sermon of repentance.",Printed for Tho Flesher,London,"Dissenters, Religious; England.",1682
A40761,R29520,F257,"A few lines given forth and a true testimony of the way which is Christ whom the saints enjoyes who have believed in the light and followed it into the regeneration, which they come to know through the preaching of the Gospel which hath been received in the power of God in these latter dayes and hath been preached in the demonstration of the Spirit.","Fairman, Lydia.",Printed for Thomas Simmons,London,Society of Friends.; Inner Light.,1659
A42271,R21762,G2161,"A vindication of the conforming clergy from the unjust aspersions of heresie, &c. in answer to some part of Mr. Jenkyn's funeral sermon upon Dr. Seaman : with short reflexions on some passages in a sermon preached by Mr. J.S. upon 2 Cor. 5:20 : in a letter to a friend.","Grove, Robert, 1634-1696.",Printed for Walter Kettilby,London,"Church of England; Jenkyn, William, 1613-1685.; Clergy.; Exodus.; Seaman, Lazarus, d. 1675.",1676
A44674,R215391,H3022,"A discourse of an unconverted man's enmity, against God Preached to a country congregation, by J.H. And publish'd by one who wrote it from his mouth.","Howe, John, 1630-1705.",printed by J Heptinstall,London,Conversion; Repentance; Proof; God; Early works to 1800.,1700
A41072,R31506,F642,"Womens speaking justified, proved and allowed of by the Scriptures, all such as speak by the spirit and power of the Lord Jesus and how women were the first that preached the tidings of the resurrection of Jesus, and were sent by Christ's own command, before he ascended to the Father, John 20:17.","Fox, Margaret Askew Fell, 1614-1702.; Fox, Margaret Askew Fell, 1614-1702. A touch-stone.",s n,London printed,Christianity.; Religious aspects; Controversial literature.; Society of Friends; Women; Women in Christianity.,1666
A47973,R9509,L1368,"A letter from a clergy-man in the country, to a minister in the city, concerning ministers intermedling with state-affairs in their sermons & discourse",Clergy-man in the country.,s n,London,England.; Church and state,1689
A42539,R8940,G420,"Upon the meeting of the sons of the clergy at a sermon preached before them in Saint Pauls church the eighth of November, 1655 specifying their several capacities, as they stood in the time of the law, and now under the gospel / by E. G.","Gayton, Edmund, 1608-1666.",Printed by T R,London,No Keywords,1655
A49256,R220429,L3175,"Short and plaine animadversions on some passages in Mr. Dels sermon first preached before the Honourable House of Commons on Novemb. 25. 1646. But since printed without their order Setting forth the many dangerous and destructive assertions therein both to church and state, the covenant, and the reformation so much desired. Together, with an answer to an unlicensed pamphlet annext to the sermon, entituled, A reply to Master Loves contradictions. By Christopher Love minister of Anne Aldersgate, London. The second edition. Imprimatur Ja. Cranford. Decemb. 17. 1646.","Love, Christopher, 1618-1651.",printed by R Cotes for Iohn Bellamie at the three Golden Lions in Cornhill neer the Royall Exchange,London,"Dell, William, d. 1664.; Great Britain; 17th century; Government; Right reformation; Church of England; Church polity; Church history; Early works to 1800.",1647
