id,estc,stc,title,authors,publisher,pubplace,subject_headings,date
A31039,R11565,B910,"The rector of Sutton committed with the dean of St. Paul's, or, A defence of Dr. Stillingfleet's Irenicum, his discourses of excommunication, idolatry, and other writings, against his late sermon entituled, The mischief of separation by the author of the Christian temper, in a letter to a friend.","Alsop, Vincent, 1629 or 30-1703.; Barret, John, 1631-1713.",Printed by J D to be sold by Richard Janeway,London," Mischief of separation. --  Irenicum. -- Stillingfleet, Edward, 1635-1699.",1680
A60568,R566,S4231A,"The life and death of Mr. William Moore, late fellow of Caius Colledge, and keeper of the University-Library as it was delivered in a sermon preached at his funeral-solemnity, April 24, 1659, in St Maries Church in Cambridge / by Tho. Smith ...","Smith, Thomas, 1623 or 4-1661.; Hammond, Henry, 1605-1660.",Printed by John Field printer to the University of Cambridge,Cambridge,"Funeral sermons. -- Sermons, English. -- Moore, William, 1590-1659.",1660
A64394,R34652,T736,"Publii Terentii Carthaginiensis Afris poëtae lepidissimi comoediae sex Anglo-Latinae in usum ludi-discipulorum, quo Feliciùs venustatem linguae Latinae ad sermonem quotidianum exercendum assequantur / a Carolo Hoole ... = Six comedies of that excellent poet Publius Terentius, an African of Carthage, in English and Latine : for the use of young scholars, that they may the more readily attain the purity of the Latine tongue for common discourse / by Charles Hoole ...","Hoole, Charles, 1610-1667.; Terence.",Printed for the Company of Stationers,London,Latin drama (Comedy),1663
A68546,S113745,19091,"God be thanked A sermon of thanksgiuing for the happy successe of the English fleetes, sent forth by the honourable company of aduenturers to the East Indies. Preached to the honourable gouernors and committees, and the whole company, of their good ship, the Hope Marchant happily returened: at Deptford on Maundy Thursday last being the 29th of March. 1616. Hereunto are added sundry necessary and vseful formes of prayer and thankes-giuing for the helpe of all such as trauell by sea, fitted to their seruerall occasions. By Samuel Page Dr. in Diuinitie.","Page, Samuel, 1574-1630.",Printed by Nicholas Okes for Simon Waterson and are to bee sold at his shop in Pauls Church yard at the signe of the Crowne,London," 17th century. --  Early works to 1800. --  Prayer-books and devotions -- Sailors -- Sermons, English",1616
A65419,R691,W1310,"A vindication of the present great revolution in England in five letters pass'd betwixt James Welwood, M.D. and Mr. John March, Vicar of Newcastle upon Tyne : occasion'd by a sermon preach'd by him on January 30. 1688/9 ...","Welwood, James, 1652-1727.; March, John, 1640-1692.",Printed and sold by R Taylor,London," 17th century. -- Great Britain --  Church history --  1689-1714. -- Sermons, English --  History",1689
A77638,R206796,B5014,"The naked vvoman, or a rare epistle sent to Mr. Peter Sterry minister at Whitehall; desiring him to shew the causes or reasons of his silence, in that he neither by his ministeriall office, charged the magistrates that were present to redresse, nor so much as shewd any sign of grief or detestation, as became a sincere Christian; against that most strange ans shamefull late act of an impudent woman, in the midst of his sermon on a Lords day at Whitehall chapell, concerning the resurrection, before the chief states of this nation. A satisfactory answer he returned; which with a lving acceptance thereof, are here also printed; very worthy the observation of all, both sexes and degrees of people in these nations.","Sterry, Peter, 1613-1672.; Brown, David, fl. 1650-1652.",printed for E Blackmore at the Angel in Pauls Church yard,London," Early works to 1800. -- Religion --  Naked woman, or a rare epistle to sent to Mr. Peter Sterry minister at Whitehall. -- Sterry, Peter, 1613-1672. -- Brown, David, fl. 1650-1652.",1652
A78013,R206611,B6143,"An individuall letter to every man that calls himselfe a minister of Jesus Christ. Penned more particularly for Mr. Christopher Love, upon some observations from his sermon, preached Jan. 29. 1644. at Windsor, and re-preached at Uxbridge, Jan. 30. 1644. upon Jer. 33. 6. Whereby the author doth examine and enquire, whether Master Love were ever called by God, and Jesus Christ, or directed by the spirit of truth to preach the said sermon: or ever sent forth by Jesus Christ to be his minister. Being also for a caveat or memento to all others who call themselves Christs ministers, to examine whether ever they had a mission or commission from Jesus Christ so to doe, the having embroyled the land of our nativity in an unnaturall warre formerly one with another, contrary to any command, precept, or practises of Christ and his apostles, or word of truth: by whose evill practises they have caused the gospel of truth and peace to be evill spoken of, and have opened a torrent of blood, which none but the heavenly physitian can stop and cure; to whom the author intreateth the people to looke, and pray, and waite for help, for vain is the help of man. Written by an English man, Christs servant, for Englands remembrance.","Burt, Nathaniel, fl. 1644-1655.",s n,London," Early works to 1800. -- Lay preaching -- Love, Christopher, 1618-1651. -- Clergy",1651
A42577,R21980,G461,"A third letter to F. Lewis Sabran, Jesuit wherein the defence of his challenge concerning invocation of saints is examined and confuted.","Gee, Edward, 1657-1730.",Printed for Ric Chiswell,London,"Sabran, Lewis, 1652-1732. --  Controversial literature. --  Sermon preached before the King at Chester on August 28, being the feast of Saint Augustin. -- Catholic Church",1688
A47973,R9509,L1368,"A letter from a clergy-man in the country, to a minister in the city, concerning ministers intermedling with state-affairs in their sermons & discourse",Clergy-man in the country.,s n,London,Church and state --  England.,1689
A42539,R8940,G420,"Upon the meeting of the sons of the clergy at a sermon preached before them in Saint Pauls church the eighth of November, 1655 specifying their several capacities, as they stood in the time of the law, and now under the gospel / by E. G.","Gayton, Edmund, 1608-1666.",Printed by T R,London,No Keywords,1655
A45574,R224188,H756,Posita dubitatione cartesiana certa veritatis norma habèri non potest,"Hare, Francis, 1671-1740.",s n,s l," 17th century. -- Sermons, English",1700
A00164,S115848,1016,"Lessus in funere Raphaelis Thorii medici et poetæ præstantissimi, qui Londini peste extinctus bonis et doctis omnibus triste sui desiderium reliquit, Anno 1625.","Aytoun, Robert, Sir, 1570-1638.",Printed by Edward Allde for Thomas Walkley,London," Early works to 1800. -- Funeral sermons --  17th century. --  Poetry -- Thorius, Raphael, d. 1625",1626
A00156,S115847,1015,"In obitum Thomæ Rhædi viri vndequaque meritissimi, et serenissimo regi ab epistolis Latinis epicedium.","Aytoun, Robert, Sir, 1570-1638.",By E Allde,London," Early works to 1800. -- Funeral sermons --  17th century. -- Reid, Thomas, d. 1624 --  Poetry",1624
A09418,S105978,19710,"The foundation of Christian religion gathered into sixe principles. And it is to bee learned of ignorant people, that they may be fit to hear sermons with profit, and to receiue the Lords Supper with comfort.","Perkins, William, 1558-1602.",Printed by Thomas Orwin for Iohn Porter,London, Early works to 1800. -- Theology,1591
A11848,S1133,22150,"Fury fiered, or, Crueltie scourged preached at S. Buttolphs without Bishops-gate, Nouem. 18. 1623 / by Iohn Sedguuick ...","Sedgwick, John, 1600 or 1601-1643.",by I L for William Sheffard and be sold at his shop at the entring of Popes head Alley out of Lumbard streete,London," 17th century. -- Sermons, English",1624
A18019,S270,4668.5,"Achitophel, or, The picture of a wicked politician devided into three parts : a treatise presented heretofore in three sermons to the Vniversitie of Oxford and now published / by Nathanael Carpent[er].","Carpenter, Nathanael. 1589-1628?",Imprinted by the Company of Stationers,Dublin," 17th century. -- Sermons, English",1627
A13299,S103240,23605,"A Christian reprofe against contention Wherin is declared and manifested a just defence of the Church against such slanderes and reproches which Sabine Staresmore hath layd vpon vs in his two bookes, the first being 16 questions, called a louing tender. The second is his preface and postscript befor and behind Mr. Answorths last sermon, and making a pretence by that to sett it out as a loue token, hee breetheth out his malice against vs: and lastly her is an answer to a letter written by Mr. Robinson, and sent to vs with the consent of his Church, which now Mr. Staresmore hath published to the world. To these things an answer is giuen by A.T.","A. T., fl. 1631.; Thatcher, Anthony, attributed name.",Successors of G Thorpe,Amsterdam," Early works to 1800. -- Brownists -- Staresmore, Sabine",1631
A14927,S103299,25236,"The cure of a hard-heart First preached in diuers sermons, by Master Welsthed, resident at Bloxford in Dorcetshire. Since digested into questions and answers for the hungrie. Shewing hardnes of hart what it is, with the causes, effect, and remedies.","Welstead, Robert, 1571 or 2-1651.; Hart, John, D.D.",Printed by Will Stansby for Samuel Man dwelling at the signe of the Swan in Pauls Church yard,London," Early works to 1800. -- Christian life -- Sermons, English",1630
A30903,R216281,B737,"Theses theologicæ: or The theological propositions, which are defended by Robert Barclay, in his apology for the true Christian divinity as the same is held forth and preached, by the people called Quakers. First printed about the year, 1675. And since then, reprinted several times, to prevent mistakes concerning that people.","Barclay, Robert, 1648-1690.",s n,London, Early works to 1800. -- Society of Friends -- Quakers,1675
A36190,R12019,D1755,"Queries upon queries, or, Enquiries into Certain queries upon Dr. Pierce's sermon at Whitehall, Feb. 1","Dobson, John, 1633-1681.",Printed for R Royston,London," Primitive rule of reformation. -- Pierce, Thomas, 1622-1691. -- Certain queries upon Dr. Pierces sermon, at Whitehall, Feb. 1.",1663
A31459,R36292,C1653,"The life and death of that holy and reverend man of God, Mr. Thomas Cawton ... with severall of his speeches and letters, while in exile, for his loyalty to the Kings Most Excellent Majesty : to which is annexed a sermon preach'd by him at Mercers Chappel, Febr. 25. 1648 ... : published with the approbation of several of his brethren, ministers of the Word in London.","Cawton, Thomas, 1637-1677.",Printed for Tho Basset and R Hall,London,"Cawton, Thomas, 1605-1659.",1662
A26859,R10441,B1183,"Richard Baxters answer to Dr. Edward Stillingfleet's charge of separation containing, I. some queries necessary for the understanding of his accusation, II. a reply to his letter which denyeth a solution, III. an answer to his printed sermon : humbly tendred, I. to himself, II. to the Right Honourable the Lord Mayor and the court of aldermen, III. to the readers of his accusation, the forum where we are accused.","Baxter, Richard, 1615-1691.",Printed for Nevil Simmons and Thomas Simmons,London," Mischief of separation. -- Dissenters, Religious --  England. -- Stillingfleet, Edward, 1635-1699.",1680
A26426,R28928,A608,"Advertisement be [sic] Agnes Campbel relict of the deceast Master William Guthrie, minister of the Gospel, unto whose hands some printed papers called sermons, bearing the said Master William his name, may come.","Campbel, Agnes.",s n,Edinburgh," 17th century. -- Presbyterian Church --  Sermons. -- Guthrie, William, 1620-1665. -- Sermons, English",1666
A26065,R4907,A4033,"Evangelium armatum, A specimen, or short collection of several doctrines and positions destructive to our government, both civil and ecclesiastical preached and vented by the known leaders and abetters of the pretended reformation such as Mr. Calamy, Mr. Jenkins, Mr. Case, Mr. Baxter, Mr. Caryll, Mr. Marshall, and others, &c.","Baxter, Richard, 1615-1691.; Calamy, Edmund, 1600-1666.; Assheton, William, 1641-1711.",Printed for William Garret,London," History -- Great Britain --  Puritan Revolution, 1642-1660.",1663
