id,estc,stc,title,authors,publisher,pubplace,subject_headings,date
A66932,R206983,W3399,"A little stone, pretended to be out of the mountain, tried, and found to be a counterfeit, or, An examination & refutation of Mr. Lockyers lecture, preached at Edinburgh, anno 1651, concerning the mater of the visible church and afterwards printed with an appendix for popular government of single congregations : together with an examination, in two appendices, of what is said on these same purposes in a letter of some in Aberdene, who lately have departed from the communion and government of this church / by James Wood ...","Wood, James, 1608-1664.",Printed by Andro Anderson for George Suintoun and Robert Broun and are to be sold at their shop,Edinburgh,"Litle stone out of the mountain church-order briefly opened.; Lockyer, Nicholas, 1611-1685.; Marks.; Conversion.; Church",1654
A64556,R23566,T972,"The charge of schism renewed against the separatists in answer to the renewer of that pretended peaceable design, which is falsly call'd, An answer to Dr. Stillingfleet's late sermon.","S. T. (Samuel Thomas), 1627-1693.",Printed for Henry Brome,London,Schism.,1680
A48191,R27642,L1676,"A Letter to a member of Parliament now in the country upon the occasion of the sermon preached before the Honourable the House of Commons at St. Margaret's Westminster, Jan. 30th, and lately publish'd which letter is contained a just and seasonable and too necessary vindication of K. Charles I, and of all the kings of England that ever were before him or shall be after him and of the English monarchy.",Anonymous,Printed and sold by John Nutt,London,1642-1649.; Politics and government; Great Britain; Kings and rulers.,1700
A49635,R5552,L489,"The last letters, to the London-merchants and faithful ministers concerning the further proceedings of the conversion and restauration of the Jews with most strange and wonderful miracles performed by the holy captain general of the wandring Israelites, a prophecie touching the downfall of Babylon in 66, and the time of the Gospel to be preach'd throughout the whole world, the number of their great armies, a description of their persons, habits, and weapons, the routing of the King of Arabia, and killing many thousand Turks, and the fearful dream of the Turkish Emperour, worthy of observation by all good Christians.","Serrurier, Petrus.",Imprinted for G Cotton,London,No Keywords,1665
A41073,R29424,F643,"VVomens speaking justified, proved and allowed of by the Scriptures all such as speak by the spirit and power of the Lord Iesus : and how women were the first that preached the tidings of the resurrection of Jesus and were sent by Christ's own command before he ascended to the Father, John 20:17.","Fox, Margaret Askew Fell, 1614-1702.; Fox, Margaret Askew Fell, 1614-1702. A touch-stone.",s n,London,Christianity.; Religious aspects; Controversial literature.; Society of Friends; Women; Women in Christianity.,1667
A48172,R24003,L1650,A Letter to a friend in the country concerning the use of instrumental musick in the worship of God in answer to Mr. Newte's sermon preach'd at Tiverton in Devon on the occasion of an organ being erected in that parish-church.,"Newte, John, 1655?-1716. Lawfulness and use of organs in the Christian Church.",Printed for A Baldwin,London,Music in churches.,1698
A48424,R216530,L2043,"England's fair warning to a speedy repentance: being an earnest exhortation to a holy life: or The only deliverer from eternal death and destruction Wherein is plainly laid down the great duty of speedy repentance; with the wretched state of a sinner, and the blessed state of a saint: shewing how the one (after death) will be cast for ever into the dreadful flames of Hell-fire: and the other will be received up into Heaven, to celebrate eternal halelujah's to the Lord of Lords, who (sitting at the right-hand of his father) will shortly come to judge the world. Likewise, some pithy arguments to persuade men to close with Christ. Preached by R. Liford, a B.D. since the dreadful earthquakes that have lately happen'd; ... And now published, to awaken drowsie sinners, who still lye in security, whilst God's judgements are on the earth.","Liford, R.",printed for J Blare at the Looking glass on London Bridge,London,Christian literature; Repentance; Early works to 1800.,1693
A42715,R16126,G686,"The life of God, which is the light and salvation of men, exalted, or, An answer to six books or particular treatises, (given forth by John Cheyney, an Episcopal priest at or near Warrington in the county of Lancaster, against the people of God call'd Quakers) intituled : 1st book, Quakerism subverted, 2nd book, Quakerism heresie, 3rd book, Sermons of hypocrisie, 4th book, A call to prayer, 5th book, The Shibboleth of Quakerism, 6th book, One sheet against the Quakers wherein the said people are cleared from his slanders and calumnies, and divers weighty particulars are seriously, experimentally and scripturally treated on for the information of such who are dis-satisfied with the principles and practices of the said people / by ... William Gibson.","Gibson, William, 1629-1684.",s n,London,J. C.; Society of Friends; Controversial literature.; (John Cheyney),1677
A45123,R22261,H3668,"An answer to Dr. Stillingfleet's sermon, by some nonconformists, being the peaceable design renewed wherein the imputation of schism wherewith the doctor hath charged the nonconformists meetings, is removed, their nonconformity justified, and materials for union drawn up together, which will heal both parties.","Lobb, Stephen, d. 1699.; Humfrey, John, 1621-1719.",Printed for J Janeway,London,"Schism.; Stillingfleet, Edward, 1635-1699.; Dissenters, Religious; England.; Mischief of separation.",1680
A46883,R220740,J743,"The Jewes message to their brethern in Holland; and a new letter touching their further proceedings sent from the kingdom of Scotland: with the arrive [sic] of some of them near Aberdeen, in a small ship, whose sails were white cranched sattin, their ropes and tackling silk of the sames colour; and their food on board only rice and pure honey. Also, another letter from Dr. Serarias, to doctor Homes; the rendovouzing of sexteen hundred thousand in the Turks dominions; and threescore thousand come into Europe; the Great Turks sad and fearful dream; and strange miracles performed by the Captain-general of the wandring Israelites; a description of their persons, habits, and weapons; the granting of liberty of conscience to all excepting infidels; a prophecie touching the downfal of Babylon in 66, and the year of reformation for the Gospel to be preached throughout all nations.",Anonymous,printed for George Freeman,London,Ethnic relations; History; Turkey; Jews; Early works to 1800.,1665
A40538,R26736,F2275A,"A Full and certain relation concerning the horrid plot of the papists and the barbarous and bloody murther of Sr. Edmund Bury Godfrey, one of His Majesties justices of the peace ... with an exact account in what manner he was found and what wounds he had on his body : together with the most noble manner of his being buried and the text of the sermon there preached ...",Anonymous,Printed for Lawrence White,London,"Popish Plot, 1678.; Godfrey, Edmund Berry,; Sir, 1621-1678.",1678
A41496,R37400,G1182,"Moses made angry, or, A letter written and sent to Dr. Hill, master of Trinity Colledg in Cambridg upon occasion of some hard passages that fell from him in a sermon preached at Pauls, May 4, 1651 / by John Goodwin.","Goodwin, John, 1594?-1665.",Printed by J M for Henry Cripps and Lodowick Lloyd,London,"Goodwin, John, 1594?-1665.; Redemption redeemed.; Hill, Thomas, d. 1653.; Theology, Doctrinal.; Redemption.",1651
A45149,R5169,H3700,"Peace at Pinners-Hall wish'd, and attempted in a pacifick paper touching the universality of redemption, the conditionality of the covenant of grace, and our freedom from the law of works upon occasion of a sermon ... / by a lover of truth and accommodation.","Humfrey, John, 1621-1719.",Printed and are to be sold by Randal Taylor,London,Redemption.; Grace (Theology),1692
A44497,R216477,H2802,"Essays about general and special grace y way of distinction between; or distinct consideration of 1. The object of divine faith, or the truth to be preached to, and believed by men. And, 2. Gods purposes for dispensing. And, 3. His dispensations of the said truth, and the knowledge of it to men. And, 4. The operations of God with it in men in the dispensation of it. By Jo. Horne, late of Lin-Allhallows.","Horn, John, 1614-1676.",printed for S Walsall at the Heart and Bible on the west side of the,London,Grace (Theology); Early works to 1800.,1685
A46371,R14047,J1212,"The reflections of the reverend and learned Monsieur Jurieu, upon the strange and miraculous exstasies of Isabel Vincent, the shepardess of Saov in Dauphiné who ever since February last hath sung psalms, prayed, preached, and prophesied about the present times in her trances : as also upon the wonderful and portentous trumpetings and singing of psalms that were heard by thousands in the air, in many parts of France, in the year 1686 : taken out of the pastoral letters of the 1st and 15th day of October last : to which is added, A letter of a gentleman in Dauphiné, to a friend of His in Geneva, containing the discourses and prophesies of the shepherdess / all faithfully translated out of the French copies ...","Jurieu, Pierre, 1637-1713.",Printed for Richard Baldwin,London,"Miracles; Early works to 1800.; Vincent, Isabel.",1689
A45240,R20540,H3825,"An exposition of the book of Job being the sum of CCCXVI lectures, preached in the city of Edenburgh / by George Hutcheson ...","Hutcheson, George, 1615-1674.",Printed for Ralph Smith,London,Bible.; Commentaries.; Job; O.T.,1669
A55289,R17446,P2736,A Poetical essay devoted to the glorious memory of our late queen occasion'd by a number of poems and sermons upon her death.,Anonymous,s n,London,"Queen of England, 1662-1694; Mary; Poetry.; II,",1695
A58940,R7898,S223A,"A sacramental-question concerning assurance how far necessary to a worthy communicant, practically answered, in a sermon, preparatory to the Lord's-Supper, Saturday, March 2, 1699/1700.",J. S.,Printed by J Brudenell for John Fawkner,London,Lord's Supper.,1700
A52641,R41534,N199A,"A Narrative of the most deplorable death and burial of that never to be forgotten pattern of love to his countrey, Capt. William Bedlow, who deceased the 20th of August 1680 with his attestations that he left in writing for the good of this nation, concerning the late damnable plot ... with the text preach'd at his funeral ... also a true account of the murder commited by the Earl of Pembroke, on the watch belonging to Chiswick ... with the whole relation of the two prophets at Tholouze, in France ... with their nine prophecies.",Anonymous,Printed for P Brooksby,London,"Murder; Popish Plot, 1678.; London; England; Prophecies; Bedloe, William, 1650-1680.; 17th century.; Pembroke, Philip Herbert,; Earl of, 1653-1683.; Early works to 1800.",1680
A58328,R36704,R665,"Animadversions by way of answer to a sermon preached by Dr. Thomas Kenne, Lord Bishop of Bath and Wells, in the Cathedral Church of Bath, on Ascension-Day last, being the fifth day of May, 1687","Reed, John, Father.",Printed for Nathaniel Thompson,London,"Apologetic works.; Ken, Thomas, 1637-1711.; Catholic Church",1687
A56278,R28464,P4203,"Pulpit sparks, or, Choice forms of prayer by several reverend and godly divines ; used by them both before and after sermons ; with other prayers for extraordinary occasions ; together with Dr. Hewytt's last prayer.","Hewit, John, 1614-1658.",Printed for W Gilbertson,London,Prayers.,1659
A58892,R37197,S218,"A letter to a peer of the Church of England clearing a point touched in a sermon preached at Chester, before His Most Sacred Majesty, on the 28th of August, in answer to a post-script joyned unto the answer to Nubes testium.","Sabran, Lewis, 1652-1732.",Printed by Henry Hills,London,"Apologetic works.; Gee, Edward, 1657-1730.; Authority; Answer to the compiler of the Nubes testium.; Religious aspects.; Catholic Church",1687
A53185,R203029,O123KA,"The Observator vindicated, or An answer to Mr. Smythies's Reply to the Observator together with a brief, but just, censure on his sermon annex'd to it.",Anonymous,printed for Walter Davis in Amen Corner,London,"L'Estrange, Roger,; Smythies, William, d. 1715.; Fredom of religion; Sir, 1616-1704.; England; Reply to the Observator; Controversial literature; Early works to 1800.",1685
A54347,R32208,P151,"The mystery of the Gospel unvail'd wherein is plainly shewed and proved, that the man Christ Jesus has honoured all the perfections of God more than Adam and all his posterity could have done, had they continuted in their primitive state of innocency / first preached, and now published by Samuel Pack.","Pack, Samuel.",Printed for the author,London,Jesus Christ; Divinity.; Sinlessness.,1691
A50026,R222044,L961,"Sionis reductio, & exultatio. Or, Sions return out of captivity with Sions reioycing for her return. A discourse, intended for the solemn festivity of the English nation, at Livorno in Italy, upon the happy news of King Charles the Second his return into England, which was there celebrated with munificent feasting, and magnificent shows, fire-works, and other signs of triumph, three days together, in the month of July anno Dom. 1660. Since occasionally preached in part, at St. Margarets in Westminster, the Sonday [sic] after the solemnization of the Kings birth-day, and entry into London; and now presented to publick view, as to correct the mis-apprehension, and mis-interpretation of some that were present; so to prevent the mis-information, and depravation of others that were absent. By Ro. le Grosse, cleric. An orthodox priest of the Church of England; and D. Oecumenical, then residing in Livorno, at his return from grand Cairo in Egypt.","Le Grosse, Robert.",printed by Tho Leach,London,"Sovereign (1660-1685 : Charles II); Great Britain; England and Wales.; Restoration, 1660-1668; History; Kings and rulersl; Early works to 1800.",1662
A10242,S4427,20521.8,"The heart of the king, and the king of the heart, or, A briefe vnfolding of that remarkable proverbe of the royall preacher ... written in the time of His Maiesties abode at Plimmouth, and preferred vnto him in his returne from thence, anno 1625 : together with a short meditation vpon 2. Sam. 24.15., preached at a weekely lecture in Deuon, in those fearefull times of mortalitie / by J.P. Master of Arts and minister of the gospell.","Pyne, John.; J. P.",Printed by William Stansby,London,"O.T.; Proverbs XXI, 1; Bible.; Criticism, interpretation, etc.; Samuel, 2nd, XXIV, 15",1628
A16497,S106544,3410,"God and man. Or, a treatise catechisticall wherein the sauing knowledge of God and man is plainely, and breifely declared, whereby such as are ignorant may be helped, to heare sermons with profit, to reade the Bible or other bookes with iudgement, to receiue the Lords Supper with comfort, to discerne betweene truth and error, with vnderstanding, and to giue an answere to their minister, or any other that shall aske them a reason of their faith, with readinesse. Collected out of the sacred Scriptures, and the most orthodoxe and best approued diuines ancient and moderne, for the good of such as desire to be made wise to saluation, and heires of eternall life. By I.B. preacher of the Word.","Boughton, John, preacher of the word.",Printed by N icholas O kes for Samuel Man and are to be sold at his shop in Paules Church yard at the signe of the Swanne,London,English.; Catechisms; Church of England,1623
A18267,S4581,4884.5,"A table alphabeticall contayning and teaching the true writing and vnderstanding of hard vsuall English wordes, borrowed from the Hebrew, Greeke, Latine, or French &c. : with the interpretation thereof by plaine English words, gathered for the benefit and help of all vnskilfull persons : whereby they may the more easily and better vnderstand many hard English words, which they shall heare or read in Scriptures, sermons, or elsewhere, and also be made able to vse the same aptly themselues / set foorth by R.C. ; and newly corrected, and much inlarged by T.C.","T. C.; Cawdry, Robert.",Printed by T S for Edmund Weauer and are to be sold at his shop at the great north dore of Paules Church,London,Dictionaries; English language; Early works to 1700.,1609
A19037,S116664,5454,"The parable of the vncleane spirit pithily opened, and plainly applied; wherein is shewed Sathans possession, his dispossession, and repossession. A worke needfull for these secure times, in which the most neglect the meanes oftheir salvation. Preached, and now published, by Edmund Cobbes minister of the Word of God.","Cobbes, Edmund, b. 1592 or 3.",By T Cotes for Iohn Bellamie dvvelling at the three Golden Lyons in Cornehill,Printed at London,Christian life; Early works to 1800.; Salvation,1633
A13209,S118002,23507,"Lectures vpon the eleventh chapter to the Romans. Preached by that learned and godly divine of famous memorie, Dr. Sutton, in St. Marie Overies in Southwarke. Published for the good of all Gods Church generally, and especially of those that were then his hearers","Sutton, Thomas, 1585-1623.; Downame, John, d. 1652.",Printed by I ohn H aviland for Nicolas Bourne and are to be sold at his shop at the south entrance of the Royall Exchange,London,Commentaries; Bible.; Romans XI; Early works to 1800.; N.T.,1632
A19614,S117464,6048,"Collections out of S. Augustine and some few other Latine writers upon the first part of the Apostles Creed. By John Crompe, Master of Arts of C.C.C. in Cambridge, and vicar of Thornham in Kent. First preached in his Parish Church; and now inlarged (as here followes) for more publike use.","Crompe, John.",Printed by John Haviland for William Lee and are to be sold at his shop neere the Miter Taverne in Fleet street,London,Apostles' creed; Early works to 1800.,1638
A19036,S117518,5453,"Mundanum speculum, or, The worldlings looking glasse Wherein hee may clearly see what a woefull bargaine he makes if he lose his soule for the game of the vvorld. A worke needfull and necessarie for this carelesse age, wherein many neglect the meanes of their saluation. Preached and now published by Edmund Cobbes, master of the Word of God.","Cobbes, Edmund, b. 1592 or 3.",Printed by M Flesher for Phillip Waterhouse and are to be sold at his shop at the signe of St Pauls Head in Canon street neare London Stone,London,Christian life; Early works to 1800.,1630
A08552,S113626,1887,"The Christian conflict a treatise, shewing the difficulties and duties of this conflict, with the armour, and speciall graces to be exercised by Christian souldiers. Particularly applied to magistrates, ministers, husbands, wives, parents, children, masters, servants. The case of vsury and depopulation, and the errours of antinomists occasionally also discussed. Preached in the lecture of Kettering in the county of Northampton, and with some enlargement published by Ioseph Bentham, rector of the Church of Broughton in the same county.","Bentham, Joseph, 1594?-1671.",Printed by G M iller for Philemon Stephens and Christopher Meredith at the golden Lion in Pauls Church yard,London,Christian life; Early works to 1800.,1635
A04221,S107530,14340,"A treatise of the sufferings and victory of Christ, in the work of our redemption declaring by the Scripturs these two questions: that Christ suffered for vs the wrath of God, which we may well terme the paynes of hell, or hellish sorrowes. That Christ after his death on the crosse, went not into hell in his soule. Contrarie to certaine errours in these points publiklie preached in London: anno 1597.","Jacob, Henry, 1563-1624.",Printed by Richard Schilders,Middelburg,Jesus Christ; Redemption; Early works to 1800.,1598
A06160,S100760,16651,"Christs communion with his church militant First preached, and now published, for the good of Gods church in generall. By Nicholas Lockyer, Mr. of Arts.","Lockyer, Nicholas, 1611-1685.",Printed by E G riffin for Iohn Rothwell at the Sunne in S Pauls Church yard,London,Spiritual lifex; Early works to 1800.; Consolation; Anglican authors,1640
A03928,S104340,14036,"The second and last part of Reasons for refusall of subscription to the Booke of common prayer vnder the hands of certaine ministers of Deuon. and Cornwall, as they were exhibited by them to the right Reuerend Father in God William Cotton Doctor of Diuinitie, and Lord Bishop of Exceter. As also an appendix, or compendious briefe of all other exceptions taken by others against the bookes of communion, homilies, and ordination, word for word, as it came to the hands of an honorable personage. VVith an ansvvere to both at seuerall times returned them in publike conference, and in diuerse sermons vpon occasion preached in the cathedrall church of Exceter by Thomas Hutton Bachiler of Diuinitie, and fellow of S. Iohns Colledge in Oxon.","Cotton, William, d. 1621.; Hutton, Thomas, 1566-1639.",Printed by Iohn Windet for the Companie of Stationers,London,Customs and practices; Church of England; Book of common prayer; Versions; English; Church of England.; Bible.; Early works to 1800.,1606
A05347,S114016,15499,"A treatise of the authority of the church The summe wherof was delivered in a sermon preached at Belfast, at the visitation of the diocese of Downe and Conner the tenth day of August 1636. By Henrie Leslie bishop of the diocese. Intended for the satisfaction of them who in those places oppose the orders of our church, and since published upon occasion of a libell sent abroad in writing, wherin this sermon, and all his proceedings are most falsely traduced. Together with an answer to certaine objections made against the orders of our church, especially kneeling at the communion.","Leslie, Henry, 1580-1661.",Printed by the Society of Stationers printers to the Kings most Excellent Majesty,Dublin,Posture in worship; Apologetic works; Early works to 1800.; Church of England,1637
A04484,S103938,14615,"An apologie of priuate masse spred abroade in writing without name of the authour: as it seemeth, against the offer and protestacion made in certayne sermons by the reuerent father Bisshop of Salsburie: with an answer to the same Apologie, set foorth for the maintenance and defence of the trueth. Perused and allowed, by the reuerent father in God Edmonde Bisshop of London, accordynge to the order appoincted in the Que'enes maiestes iniunctions.","Cooper, Thomas, 1517?-1594.",Printed by T Powell,Londini,"Jewel, John, 1522-1571.; Controversial literature.; Church of England; Mass; True copies of the letters betwene the reverend father in God John Bisshop of Sarum and D. Cole; Celebration outside the church; Early works to 1800.",1562
A06161,S108798,16652,"A divine discovery of sincerity according to its proper and peculiar nature: very profitable for all sorts of persons to peruse. First preached, and now published, for the good of Gods Church in generall. By Nicholas Lockyer Master of Arts.","Lockyer, Nicholas, 1611-1685.",Printed by E G riffin for Iohn Rothwell at the Sunne in Pauls Church yard,London,Sincerity; Early works to 1800.,1640
A00415,S101734,10545,"Certaine godly and learned expositions vpon diuers parts of Scripture As they were preached, and afterwards more briefly penned by that vvorthy man of God, Maister George Estey, sometimes fellovve of Goneuill and Caius Colledge in Cambridge. Late preacher of the word of God in Saint Edmunds Burie.","Estey, George, 1560 or 61-1601. Most sweete and comfortable exposition, upon the tenne commaundements, and upon the 51. Psalme.; Estey, George, 1560 or 61-1601.",Printed by I ames R oberts for Richard Banckworth and are to be sold in Paules Church yard at the signe of the Sunne,At London,Commentaries.; Bible,1603
A25215,R16170,A2917,"The mischief of impositions, or, An antidote against a late discourse, partly preached at Guild-hall Chappel, May 2, 1680, called The mischief of separation","Alsop, Vincent, 1629 or 30-1703.",Printed for Benj Alsop,London,"Great Britain; Stillingfleet, Edward, 1635-1699.; History; Dissenters, Religious; Stuarts, 1603-1714.; England.; Mischief of separation.",1680
A27629,R38703,B2180,"The thousand years kingdom of Christ, in its full Scripture-state answering Mr. Baxter's new treatise, in opposition to it : humbley presented to the churches of Christ, particularly to the angels of the churches / by T. Beverley, a fore-runner to the everlasting Gospel of that kingdom, near to be preach'd.","Beverley, Thomas.",s n,London,"Second Advent; Millennium; Glorious kingdom of Christ.; Baxter, Richard, 1615-1691.; Early works to 1800.",1690
A25343,R40283,A3076,"Ancient truth revived, or, A True state of the antient, suffering Church of Christ, commonly (but falsly) called Brownists, living in London, and other places of this nation wherein I. Is shewed (in the preface) the state of the gospel-church, from the time of Christ's ascension, to the end of the world, gathered out of the book of Revelations, II. The confession of our faith, grounded on the doctrine of the apostles and prophets, III. By vvhom the gospel vvas first preached in this island, IV. Our practice in the worship of God, according to the practice of the primitive church, with an explanation of every ordinance, and vvho have right to administer the same, V. The first day of the week proved to be the gospel-sabbath.",Anonymous,s n,London printed,Brownists.; Congregationalism.,1677
