id,estc,stc,title,authors,publisher,pubplace,subject_headings,date
B01388,R176291,A3354A,An answer to Clemens Alexandrinus's sermon upon Quis dives salvetur? What rich man can be sav'd? Proving it easie for a camel to go through the eye of a needle.,"Clement, of Alexandria, Saint, ca. 150-ca. 215. Quis dives salvetur?",s n,London,"England; Rich people; Wealth; Quis dives salvetur?; Clement,; 17th century.; Early works to 1800.; Broadsides; of Alexandria, Saint, ca. 150-ca. 215.; Moral and ethical aspects; Humor",1690
B03275,R36181,E477,"An elegy upon the death of two eminent ministers of the Gospel Mr. Pledger and Mr. Wells. Who both departed this life on the Lords day June the 18th. 1676. The first of them having preached twice, and administred the Lords Supper the very day of his dissolution.",Anonymous,Printed for B H,London,"Pledger, Elias, d. 1676; Elegiac poetry, English; Wells, John, 1623-1676; 17th century.; Poetry; Early works to 1800.",1676
A96415,R206427,W1999,"The light appearing more and more towards the perfect day. Or, a farther discovery of the present state of the Indians in New-England, concerning the progresse of the Gospel amongst them. Manifested by letters from such as preacht to them there. / Published by Henry Whitfeld, late pastor to the Chuch [sic] of Christ at Gilford in New-England, who came late thence.","Mayhew, Thomas, fl. 1651.; Eliot, John, 1604-1690.; Whitfield, Henry, 1597-1660?",Printed by T R E M for John Bartlet and are to be sold at the Gilt Cup neer St Austins gate in Pauls Church yard,London,Massachuset Indians; Wampanoag Indians; Massachusetts; Indians of North America; Missions; Early works to 1800.,1651
A91314,R212424,P4124,"A vindication of foure serious questions of grand importance, concerning excommunication and suspention from the sacrament of the Lords Supper, from some misprisions and unjust exceptions lately taken against them; both in the pulpit, by a reverend brother of Scotland, in a sermon at Margarets Church in Westminster, before the Honourable House of Commons, at a publike fast there held for Scotland, on the 5th of September last: and in the presse, by three new-printed pamphlets, by way of answer to, and censure of them. Wherein some scripture texts, (commonly reproduced for excommunication, and bare suspention from the Lords Supper onely,) are cleared from false glosses, inferences, conclusions wrested from them; ... / By William Prynne of Lincolns Inne, Esquire.","Prynne, William, 1600-1669.",Printed for John Macock for Michael Spark senior,London,Excommunication; Lord's Supper; Church of Scotland; Early works to 1800.,1645
A89416,R22194,M31,"A true relation of the proceedings from York and Beverley. Shewing the great power and strength there raised against the Parliament and Hull, under the command of the Lord of Carnarvon, the Lord Rich, Colonell Fielding, Colonell Fielding, Colonell Lunsford, Capt. Butler, &c. Also the bountie of the clergie, and of the gentrie in York-shire, tending to the encreasing and managing of these unhappie proceedings. Likewise some rehearsall of Bishop Williams his sermon before the King, Iuly 24. And of the great hurt that the great recusant, Mr. Beckwith hath received by Sir Iohn Hotham. Sent in a letter from Beverley, to a citizen of good worth in London.",H. M.,Aug 3 London printed for Iohn Iohnson,London,"Great Britain; History; Warwick, Robert Rich,; Earl of, 1609 or 10-1643; Earl of, 1587-1658; Campaigns; Capt.; Carnarvon, Robert Dormer,; Lunsford, Thomas,; Sir, 1610?-1653?; Williams, Gryffith, 1589?-1672; Fielding, Richard, d. 1650.; Civil War, 1642-1649; Early works to 1800.; Butler,",1642
B18418,nan,C72B,"A short discourse against transubstantiation, or, An answer to the ordinary question whether a man may be saved in the Roman Catholick religion? by the reduction of it to another, whether one can be saved who, apostasizing from a true religion joineth himself with the grossest idolaters : where the evidence against transubstantion from revelation, reason, and sense is repeated and improved in two sermons on Mat. 26. 26 / by J.C.",J. C.,Printed for Tho Parkhurst,London,Transubstantiation.; Catholic Church; Controversial literature.,1675
B07998,S94783,20308,"Anti-Mortonus or An apology in defence of the Church of Rome. Against the grand imposture of Doctor Thomas Morton, Bishop of Durham. Whereto is added in the chapter XXXIII. An answere to his late sermon printed, and preached before His Maiesty in the cathedrall church of the same citty..","Price, John, 1576-1645.",English College Press Permissu Superiorum,St Omer,"Apologetic works; Morton, Thomas, 1564-1659.; Grand imposture of the (now) Church of Rome.; Catholic Church; Early works to 1800.",1640
B03839,R178824,J107,"The Jacobite's new creed, containing the articles of their faith, and doctrine of salvation, as now preach'd and practised, &c. Licensed according to order.",Anonymous,Printed for E Golding,London,"Great Britain; William and Mary, 1689-1702; History; Political satire, English; Jacobites; 17th century.; Humor.; Religious satire, English; Early works to 1800.; Humor",1693
B05801,R183736,S2624A,"An advertisement concerning those most famous cathartique and diuretique pills. Being an incomparable medicine in all chronical and dangerous diseases; wherewith was cured the late Lord General Monck of the dropsie: : some hundreds before, and many since, having received absolute cure thereby ... / Prepared only by William Sermon ...","Sermon, William, 1629?-1679.",Printed for the author and Edward Thomas at the Adam and Eve in Little Britain,London,"Patent medicines; England; Albemarle, George Monck,; Duke of, 1608-1670.; Early works to 1800.",1671
B06138,nan,T1602,"To the Reverend Dr. Beveridge, an eucharisticon, occasion'd by his seasonable and excellent sermon about restitution, on *St. Luke 19.8. preach'd at St. Laurence's London, Tuesday, March 17. 1690.",Anonymous,s n,London,"Beveridge, William, 1637-1708; Early works to 1800.",1691
B43800,nan,R692A,"Prophetick admonitions to the city of London : of four great calamities like to befall it, viz.  1. Destruction of their houses, fullfilled in 1666.  2. Slaughters of their persons, wives and children.  3. Loss of their goods and estates, and, 4. Violation and slavery of their consciences.  And of the only means to prevent 'em. / First preached and afterwards printed, and dedicated to the citizens, by Thomas Reeves, B. in divinity, in the year 1657.","Reeve, John, 1608-1658.",Printed for J Meekes in Hanging Sword court in Fleet street,London,England; Muggletonians; Apocalyptic literature; Early works to 1800.,1694
A89104,R205297,M1899,"A message from the Isle of Wight, brought by Major Cromwell. Coll: Hammond sent for by the Lord Generall, and Col: Ewers to be at the Isle of Wight. Also the chiefe heads of Bishop Ushers sermon. And His Majesties letter to the Parliament: brought this present Munday, Novemb. 27. 1648.",England and Wales. Sovereign (1625-1649 : Charles I).,Printed for R Smithurst neer Pye corner,London,"Great Britain; Civil War, 1642-1649; Early works to 1800.; History",1648
A87719,R208730,K437,"Ancient and durable gospel. Concerning the time of the perfect and totall subduing, washing away, remitting, blotting out, and pardoning, believers sins : and believers being justified, adopted, married to Christ; and presented by Christ spotlesse. Shewing, that though these things were in purpose before the world was, in prophesie, and promise, before Christ dyed; purchased just then; and applyed by faith when we believe. Yet the said purpose is not executed; the said prophesies are not accomplisht; nor promises fulfilled; the things purchased are not effected, nor by us fully enjoyed, till Christs second comming : at which time the saints that sleep shall arise : and scattered Israel shall be gathered. / Written by Thomas Kilcop. In two books; the one iu [sic] an orderly sermon-method : the other by way of answer to a book intituled. Justification by Christ alone : a good title, were the book but sutable.","Killcop, Thomas.",Printed by H H and are to be sold by Giles Calvert living at the sign of the Black spread Eagle at the west end of Pauls,London,Justification by Christ alone.; Grace (Theology); Redemption; Early works to 1800.,1648
A84807,R177302,F1888A,"The promise of God proclaimed; which is Christ the everlasting covenant of God to the Jews, Gentiles, and all people upon the earth, which God spake by his prophets, and was preached by the apostles, and by his servants and messengers sent forth since for Barbadoes, New-England, Virginia, the East and West Indies, and the south and north parts of the vvorld, to go to them all.","Fox, George, 1624-1691.",Printed for Thomas Simmons,London,England; Divinity; 17th century.; Broadsides; Jesus Christ; Early works to 1800.; Devotional literature,1660
A81906,R205600,D2837,"A case of conscience resolved: concerning ministers medling with state matters in their sermons: and how far they are obliged by the Covenant to interpose in the affairs of civil government. / By J.D. Minister of the Gospell. March 15, imprimatur, Joseph Caryl.","Dury, John, 1596-1680.",Printed by R L for R W at the Star under S Peters Church in Cornhill,London,"Great Britain; 17th century; History; England; Solemn League and Covenant (1643).; Church history; Civil War, 1642-1649; Early works to 1800.; Preaching",1649
A86931,R200474,H3819,"A plea for Christian magistracie: or, An answer to some passages in Mr. Gillespies sermon, against Mr. Coleman. As also to the brotherly examination of some passages of Mr. Colemans late printed sermon, upon Job 11.20. In which the reverend and learned commissioner affirmeth, he hath endeavoured to strike at the root of all church government. VVherein the argumentative part of the controversie is calmely and mildly, without any personall reflections, prosecuted. / By William Hussey, minister of the Gospell, at Chesilhurst in Kent.","Hussey, William, minister of Chiselhurst.",Printed for John Saywell and are to bee sold at his shop at the signe of the Starre in Little Brittaine,London,"Church polity; Gillespie, George, 1613-1648; Coleman, Thomas, 1598-1647.; Hopes deferred and dashed.; Early works to 1800.",1645
A88596,R207307,L3182,"The true and perfect speec [sic] of Mr. Christopher Love on the scaffold on Tower-Hill on Friday last, being the two and twentieth day of this instant August, 1651. Comprizing his funerall sermon; his exhortation to the citizen his propositions touching religion; and his prayer immediately before his head was severed from his body. Together with Mr. Gibbons his speech; and the manner of his deportment, carriage, and resolution: published for the good of the Common-wealth of England.","Love, Christopher, 1618-1651.",by Iohn Clowes,Imprinted at London,"Last words; Love, Christopher, 1618-1651; Early works to 1800.",1651
A85345,R177464,G104A,"Instructions for young gentlemen: or, The instructions of Cardinal Sermonetto to his cousin Petro Caetano, at his first going into Flanders to the Duke of Parma, to serve Philip King of Spain.","Gaetani, Enrico, Cardinal, 1550-1599.",Printed by T N for Fr Bowman of Oxon,London,Diplomacy; Early works to 1800.; Diplomatic etiquette,1650
A81417,R224917,D1311A,"A dialogue; between George Keith, and an eminent Quaker relating to his coming over to the Church of England. With some modest reflections on Mr. Keith's two first sermons, preach'd at St. Georges Buttolphs Church on Sunday May the 12th. 1700.",Anonymous,s n,London,"Society of Friends; Keith, George, 1639?-1716; Controversial literature; Early works to 1800.",1700
A84789,R202174,F1839,"Here are several queries put forth in print for all, or any of you whose names are here under written, (and likewise for them at Cambridge and Oxford, ... or any other of your societies that will answer the same) and return your answer in print, to the view and satisfaction of many people; who are now questioning whether any of all your practises do proceed from the true foundation. For Robert Gell. Doctor of Divinity so called, who formerly preached to the Society of Astrologers; as witness his book called Stella nova. William Lilly. Student in astrology. John Booker. Student in astrology and physick. Richard Sanders. Student in the divine, laudible and celestial sciences, as he calls it. Vincent Wing. George Wharton. Or any other of the astrologers to answer. And likewise for Francis Prujan. John King. Charles Scarbrough. George Bates. Lawrence Wright. Jonathan Goddard. And Richard Barker. Doctors of Physick; and to the rest of that society to answer. / These queries are put in print by me, Henry Clark.","Fox, George, 1624-1691.; Clark, Henry, 17th cent.",Printed for Giles Calvert and are to be sold at his shop at the sign of the Black spread Eagle at the west end of Pauls,London,Astrology; Society of Friends; Early works to 1800.; Doctrines,1657
A84135,R22317,E3383,The deeds of Dr. Denison a little more manifested. By his ansvver to the defence of John Etherington. VVhich he published in Anno Dom. 1641. against his false accusations and the depositions of his false witnesses. Whereupon he was censured by the high commission court. And his reply to the doctors answer. Which answer he hath added to his Woolfe-sermon booke.,"Etherington, John, fl. 1641-1645.",Printed by F L and are to be sold by Iohn Wright in the little Old Baily,London,"White wolfe.; Great Britain; 17th century; Religion; Denison, Stephen, d. 1649 or 50.; Etherington, John.; Defence of J.E. against Steven Denison and his witnesses.; Early works to 1800.",1642
A84091,R176777,E3288,An essay on hypocrasie and Pharisaism. As it was set forth in a Sermon / by A curate of souls.,Curate of Souls.; J. W.,Printed by J C and Freeman Collins for Charles Yeo Bookseller in Exon,London,Religious aspects; Early works to 1800.; Hypocrisy,1683
A96995,R8440,W3778,"The covenants plea for infants: or, The covenant of free grace, pleading the divine right of Christian infants unto the seale of holy baptisme. Against the rusticke sophistry, and wicked cavillations of sacrilegious Anabaptists: being the summe of certaine sermons had in the parish-church of Cranham, neere the city of Gloucester, in Gloucester-shire, with the exceptions of certaine Anabaptists against the foresaid sermons, and the authors answers thereunto. Very seasonable for weake consciences in these unsettled times of schisme and apostacie. By Thomas Wynell minister of the Gospel of Jesus Christ.","Wynell, Thomas, b. 1599 or 1600.",Printed by Henry Hall for the author,Oxford,Anabaptists; Early works to 1800.; Infant baptism,1642
A96864,R210371,W3414,"Divine poems being meditations upon several sermons, preached at Eckington in the county of Darbie / by Mr. S.G. And put into vers by William Wood of Eckington, Gent.","Wood, William.; S. G.",Printed by Will Du Gard for the author,London,Early works to 1800.; Christian life; Poetry,1655
A90476,R203151,P1502,"A perfect narrative of the late proceedings of the Parliament of Scotland, in relation to the affaires of England. Also the manner of the funerall of the Right Honourable, Ferdinando Lord Fairfax : with the chief heads of his Lordships funerall-sermon, preached by Mr. Bowles. 15. March instant. And sundry other particulars concerning the L. Widdringdon, Sir Thomas Glemham, Sir Charles Lucas, and others late going into Scotland.","Bowles, Edward, 1613-1662.",Printed by Robert Austin,London,"Scotland; Baron, 1584-1648; Death and burial; 1625-1649; Politics and government; Fairfax, Ferdinando Fairfax,; Early works to 1800.",1648
A95939,R200964,V472,"A vindication of certaine citizens that lately went to the leaguer, then before Oxford, or, Their answer to some prevaricating passages, inserted in an epistle, lately published by William Dell, minister of the Gospel. Occasioned, by their attesting his delivering of certain positions, in a sermon at the leaguer, here set down, they being thereunto called by the House of Lords. Published by authoritie.",Anonymous,Printed by Eliz Purslow for Thomas Vere at the upper end of the Old baily,London,"Dell, William, d. 1664.; Great Britain; 17th century; England; Building and glory of the truely Christian and spiritual church.; Church and state; Church history; Early works to 1800.",1646
A96416,R186141,W199B,"Joshua's resolution; or the duties of houshold-governours discoursed of, and fairly stated; their failures therein mildly consider'd, and without favour or affection impartially weighed. The subject suited to the capacities of tamworth auditory, and preached there, and elsewhere, by John Wagstaffe, A.M. and rector of Little Wenlock, in Shropshire.","Wagstaffe, John, rector of Little Wenlock.",printed by Thomas Snowden and are to be sold by Henry Mortlack at the Phænix in St Paul s Church Yard,London,Religious education; Early works to 1800.; Teaching,1684
A76218,R207537,B1423A,"A treatise of conversion Preached, and now published for the use of those that are strangers to a true conversion, especially the grosly ignorant and ungodly. By Richard Baxter, teacher of the Church of Christ at Kederminster.","Baxter, Richard, 1615-1691.",printed by R W for Nevil Simmons bookseller in Kiderminster and are to be sold by Joseph Nevil at the Plough in Pauls Church yard,London,Conversion; Early works to 1800.,1657
A77132,R201037,672,"The description and confutation of mysticall Anti-Christ, the Familists; or, An information drawn up and published for the confirmation and comfort of the faithfull, against many Antichristian Familisticall doctrines which are frequently preached and printed in England: particularly in those dangerous books called Theologia Germanica, the Bright Star, Divinity and Philosophy dissected. / Written by Benjamin Bourne. Published according to order.","Bourne, Benjamin, fl. 1646.",Printed by Matthew Symons for B B and are to be sold at the signe of the Angel in Cornehill,London,Great Britain; Familists; England; 17th century.; Church history; Early works to 1800.,1646
A75922,R232350,A64,"Cheap-side crosse censured and condemned by a letter sent from the vicechancellour and other learned men of the famous Universitie of Oxford, in answer to a question propounded by the citizens of London, concerning the said crosse, in the yeere 1600, in which yeer it was beautified, as also some divine arguments taken out of a sermon against the crosse, a little after it was last repaired, by a learned and godly minister, M. Iohn Archer, sometimes preacher at Alhallows Lombardstreet about sixteen yeers past.","Abbot, George, 1562-1633.",printed by A N for I R and are to be sold at his shop in Pauls Church yard,London,"Early works to 1800.; Abbot, George, 1562-1633; Cheapside Cross (London, England)",1641
A75851,R203313,A452aA,"A modest reply humbly offer'd, as an answer to, and confutation of seven arguments collected and deliver'd by Mr. Samuel Lawrence, in a sermon preach'd at his meeting-house in Namptwich, Octob. 16th, 1691, whereby he would shew, that the infants of professing Christians ought to be baptized : with a seasonable word to my brethren of the baptized church / presented by the most unworthiest of her servants, S.A.","Acton, Samuel, d. 1740?; Lawrence, Samuel.",Printed for the author,London,Infant salvation.,1692
A77374,R223954,B4476A,"The vvounded conscience cured, the weak one strengthned, [sic] and the doubting satisfied By way of answer to Doctor Fearne. Where the main point is rightly stated, and objections throughly answered for the good of those who are willing not to be deceived. By William Bridge, preacher of Gods Word. It is ordered this 30. day of January, 1642. by the committee of the House of Commons in Parliament, concerning printing, that this answer to Dr. Fearnes book be printed. John White. The second edition, correced and amended. Whereunto are added three sermons of the same author; 1. Of courage, preached to the voluntiers. 2. Of stoppage in Gods mercies to England, with their [sic] remedies. 3. A preparation for suffering in these plundering times.","Bridge, William, 1600?-1670.",printed for Benjamin Allen and are to be sold at his shop in Popes head Alley,London,"Resolving of conscience; Ferne, H.; (Henry), 1602-1662.; Conscience; Early works to 1800.",1643
A77854,R201144,B5666,"Vindiciæ legis: or, A vindication of the morall law and the covenants, from the errours of papists, Arminians, Socinians, and more especially, Antinomians. In XXIX. lectures, preached at Laurence-Jury, London. / By Anthony Burgess, preacher of Gods Word.","Burgess, Anthony, d. 1664.",Printed by James Young for Thomas Underhill at the signe of the Bible in Wood street,London,Covenant theology; Antinomianism; Grace (Theology); Controversial literature; Early works to 1800.; Law (Theology),1646
A77775,R200735,B5403,"The Gospel-covenant; or The covenant of grace opened. Wherein are explained; 1. The differences betwixt the covenant of grace and covenant of workes. 2. The different administration of the covenant before and since Christ. 3. The benefits and blessings of it. 4. The condition. 5. The properties of it. / Preached in Concord in Nevv-England by Peter Bulkeley, sometimes fellow of Johns Colledge in Cambridge. Published according to order.","Bulkeley, Peter, 1583-1659.",Printed by M S for Benjamin Allen and are to be sold at the Crowne in Popes head Alley,London,Grace (Theology); Good works (Theology); Early works to 1800.,1646
A77100,R206793,B3760,"Paideia Thriamous. The triumph of learning over ignorance, and of truth over faleshood. Being an answer to foure quæries. Whether there be any need of universities? Who is to be accounted an hæretick? Whether it be lawfull to use coventicles? Whether a lay-man may preach? VVhich were lately proposed by a zelot, in the parish church at Swacie neere Cambridge, after the second sermon, October 3. 1652. Since that enlarged by the answerer, R.B. B.D. and fellow of Trin. Col. Camb.","R. B. (Robert Boreman), d. 1675.",printed by R Royston at the Angel in Ivie lane,London,Controversial literature; Early works to 1800.; Religion,1652
A62992,R222359,T1957B,"A letter to Mr. Mead, in answer to several unscriptural, and unsound sayings of his in a sermon against the seventh-day-sabbath, preached at his place of meeting, the twenty third of the second month. 1682. Wrote the same day the sermon was preached, refuting his arguments, and turning them back, making their unskilfulness and weakness manifest; and clearly evidencing, that the seventh-day is the sabbath day; by clear scripture-testimony, and sound arguments grounded thereon. Published for his hearers, because he would neither hear an objection in publick, nor admit of a conference in private.","Tovey, W.",printed for the author and are to be sold by John Lawrence at the Angel in Cornhil near the Royal Exchange,London,Sabbath; Early works to 1800.,1682
A60864,R18529,S4616,"Some short remarks upon a book, entituled, An answer (but is none) to Dr. Stillingfleet's sermon, by some nonconformists in a letter to his friend in London from a person of quality in the country.",Anonymous,Printed for Randall Taylor,London,"Dissenters, Religious; Answer to Dr. Stillingfleet's book of the unreasonableness of separation.; England.; Humfrey, John, 1621-1719.",1680
A64639,R23555,U17,"Perez Uzza, Or, A serious letter sent to Master Edm. Calamy, January the 17th, 1663 touching his sermon at Aldermanbvry, December the 28th, intimating his close design, and dangerous insinuation against the publick peace : with some queries he is to answer, for the satisfaction of the world.","Udall, O.",Printed for George Bisaker,London,"Calamy, Edmund, 1600-1666.; Eli trembling for fear of the Ark.",1663
A64197,R219145,T4E,"Diotrephes detected, corrected, and rejected, and Archippus admonished: by a soft answer to an angry sermon and book lately published, intituled, A true account of what was done, at the casting of two members out of Mr. Stucleys congregation in Exon",E. T.,printed by M S for Henry Cripps and are to be sold at his shop in Popes Head Alley,London,"Mall, Thomas, b. 1629 or 30.; Excommunication; True account of what was done by a Church of Christ in Exon; England; Dissenters, Religious; Early works to 1800.",1658
A66857,R15081,W3292,"From the shepherd of Israel, to the Bishops in England with some queries and councell to all courtiers, and judges, &c, that they incense not King Charles against the Lords heritage : also, the breathings of the seed, and crie of his own elect, that his people may be preserved, which he cannot but hear, because of the incercession of his spirit, poured out upon his off-spring : this I believe, therefore I speak : also, the arise of the beast, false prophet, and anti-christ, and who they are, and what their work is, declared : and the everlasting gospell preached again to all nations, kindreds and people, and the beast and false prophet, which deceived them taken and destroyed, the accuser of the brethren cast out, and judged / given forth by Humphry Woolrich.","Wollrich, Humphry, 1633?-1707.",Printed for Robert Wilson,London,"Society of Friends; King of England, 1630-1685.; II,; Great Britain.; Charles",1661
A63266,R1706,T2312,"An apology for the non-conformists shewing their reasons, both for their not conforming, and for their preaching publickly, though forbidden by law : with an answer to Dr. Stillingfleet's sermon, and his defence of it, so much as concerneth the non-conformists preaching / by John Troughton ...","Troughton, John, 1637?-1681.",Printed for Thomas Parkhurst,London,"Dissenters, Religious; England.; Mischief of separation.; Stillingfleet, Edward, 1635-1699.",1681
