id,estc,stc,title,authors,publisher,pubplace,subject_headings,date
B01388,R176291,A3354A,An answer to Clemens Alexandrinus's sermon upon Quis dives salvetur? What rich man can be sav'd? Proving it easie for a camel to go through the eye of a needle.,"Clement, of Alexandria, Saint, ca. 150-ca. 215. Quis dives salvetur?",s n,London," of Alexandria, Saint, ca. 150-ca. 215. --  Early works to 1800. --  17th century. --  England --  Moral and ethical aspects -- Wealth --  Quis dives salvetur? -- Clement, -- Broadsides --  Humor -- Rich people",1690
A89416,R22194,M31,"A true relation of the proceedings from York and Beverley. Shewing the great power and strength there raised against the Parliament and Hull, under the command of the Lord of Carnarvon, the Lord Rich, Colonell Fielding, Colonell Fielding, Colonell Lunsford, Capt. Butler, &c. Also the bountie of the clergie, and of the gentrie in York-shire, tending to the encreasing and managing of these unhappie proceedings. Likewise some rehearsall of Bishop Williams his sermon before the King, Iuly 24. And of the great hurt that the great recusant, Mr. Beckwith hath received by Sir Iohn Hotham. Sent in a letter from Beverley, to a citizen of good worth in London.",H. M.,Aug 3 London printed for Iohn Iohnson,London," Early works to 1800. -- Carnarvon, Robert Dormer, -- Great Britain --  Earl of, 1587-1658 --  Capt. --  Campaigns -- Warwick, Robert Rich, --  History --  Earl of, 1609 or 10-1643 -- Lunsford, Thomas, -- Williams, Gryffith, 1589?-1672 --  Sir, 1610?-1653? --  Civil War, 1642-1649 -- Fielding, Richard, d. 1650. -- Butler,",1642
B28836,,R678,"A general epistle from the Holy Spirit unto all prophets, ministers, or speakers in the world ... [by] John Reeve and Lodowick Muggleton, the two last spiritual witnesses and alone true prophets of the Holy Spirit by commission from the true God... London, 1653 in the second year of our commission by voice from Heaven.","Reeve, John, 1608-1658.; Muggleton, Lodowick, 1609-1698.",s n,London,"Astrology --  Sermons. --  17th century. -- Sermons, English",1653
B26622,,M966A,"At a council held at Boston in New-England, January 6, 1679 by the council, Edward Rawson, secretary.","Rawson, Edward, 1615-1693.; Massachusetts. Council.",Printed by John Foster,Boston," 17th century. -- Massachusetts --  Sources. --  Colonial period, ca. 1600-1775 -- Sermons, English --  History",1680
B12473,S121163,7021,"A sub-poena from the star-chamber of heauen A sermon preached at Pauls Crosse the 4. of August. 1622. With some particular enlargements which the limited time would not then allow. By Dan. Donne, Master of Arts, and minister of the Word.","Donne, Daniel, d. 1646.",Printed by Augustine Mathewes for Iohn Grismond and are to be sold at his shop in Pauls Alley at the signe of the Gunne,London," 17th century. -- Sermons, English",1623
B03839,R178824,J107,"The Jacobite's new creed, containing the articles of their faith, and doctrine of salvation, as now preach'd and practised, &c. Licensed according to order.",Anonymous,Printed for E Golding,London," Early works to 1800. --  17th century. -- Great Britain --  Humor. --  William and Mary, 1689-1702 -- Jacobites -- Political satire, English --  History -- Religious satire, English --  Humor",1693
B06138,,T1602,"To the Reverend Dr. Beveridge, an eucharisticon, occasion'd by his seasonable and excellent sermon about restitution, on *St. Luke 19.8. preach'd at St. Laurence's London, Tuesday, March 17. 1690.",Anonymous,s n,London," Early works to 1800. -- Beveridge, William, 1637-1708",1691
B09463,R223722,M1122,"Little flocks guarded against grievous wolves. an address unto those parts of New-England which are most exposed unto assaults, from the modern teachers of the misled Quakers.  In a letter, which impartially discovers the manifold haeresies and blasphemies, and the strong delusions of even the most refined Quakerism: and thereupon demonstrates the truth of those principles and assertions, which are most opposite thereunto.  Withjust reflections upon the extream ignorance and wickedness; of George Keith; who is the seducer that now most ravines upon the churches in this wilderness / written by Cotton Mather.","Mather, Cotton, 1663-1728.",Printed by Benjamin Harris John Allen at the London Coffee House,Boston,"Society of Friends --  Early works to 1800. -- Sermons, American -- Keith, George, 1639?-1716. --  Massachusetts -- Congregational churches --  Controversial literature.",1691
A89104,R205297,M1899,"A message from the Isle of Wight, brought by Major Cromwell. Coll: Hammond sent for by the Lord Generall, and Col: Ewers to be at the Isle of Wight. Also the chiefe heads of Bishop Ushers sermon. And His Majesties letter to the Parliament: brought this present Munday, Novemb. 27. 1648.",England and Wales. Sovereign (1625-1649 : Charles I).,Printed for R Smithurst neer Pye corner,London," History -- Great Britain --  Civil War, 1642-1649 --  Early works to 1800.",1648
A83012,R207678,E18,"The confident questionist questioned: or, the examination of the doctrine delivered by Mr. Thomas Willes in certain queries. Published by Mr. Jeremiah Ives. Examined by counter-queries. By N.E. with a letter of Mr. Tho. Willes.",N. E.,printed for Tho Newberry and are to bee sold at his shop in Sweetings Rents in Cornhil near the Exchange,London," 17th century. --  Early works to 1800. --  Confidence questioned. -- Ives, Jeremiah, fl. 1653-1674. -- Sermons, English --  Appointment, call, and election -- Willis, Thomas, 1619 or 20-1692. -- Clergy",1658
A81906,R205600,D2837,"A case of conscience resolved: concerning ministers medling with state matters in their sermons: and how far they are obliged by the Covenant to interpose in the affairs of civil government. / By J.D. Minister of the Gospell. March 15, imprimatur, Joseph Caryl.","Dury, John, 1596-1680.",Printed by R L for R W at the Star under S Peters Church in Cornhill,London," Early works to 1800. -- Great Britain -- Preaching --  Church history -- Solemn League and Covenant (1643). --  England --  History --  Civil War, 1642-1649 --  17th century",1649
A84063,R207188,E3222,"The babe of glory, breaking forth in the broken flesh of the saints breathing out the life of God (hid in their flesh) now to be revealed and raised, Isa. 40. 5, 6. By William Erbery.","Erbery, William, 1604-1654.",Printed by J C for Giles Calvet sic at the signe of the Black spread Eagle at the West end of Pauls,London," 17th century. -- Pastoral letters and charges. -- Sermons, English",1653
A81606,R171803,D1835A,A salutation and seasonable exhortation to children. By Dorcas Dole.,"Dole, Dorcas.",Printed and Sold by T Sowle in White Hart Court in Gracious Street,London,Children's sermons -- Society of Friends --  Pastoral letters and charges. --  England.,1700
A88596,R207307,L3182,"The true and perfect speec [sic] of Mr. Christopher Love on the scaffold on Tower-Hill on Friday last, being the two and twentieth day of this instant August, 1651. Comprizing his funerall sermon; his exhortation to the citizen his propositions touching religion; and his prayer immediately before his head was severed from his body. Together with Mr. Gibbons his speech; and the manner of his deportment, carriage, and resolution: published for the good of the Common-wealth of England.","Love, Christopher, 1618-1651.",by Iohn Clowes,Imprinted at London," Early works to 1800. -- Last words -- Love, Christopher, 1618-1651",1651
A81417,R224917,D1311A,"A dialogue; between George Keith, and an eminent Quaker relating to his coming over to the Church of England. With some modest reflections on Mr. Keith's two first sermons, preach'd at St. Georges Buttolphs Church on Sunday May the 12th. 1700.",Anonymous,s n,London," Early works to 1800. --  Controversial literature -- Keith, George, 1639?-1716 -- Society of Friends",1700
A85341,,G1038,"The good Catholick no bad subject. Or, A letter from a Catholick gentleman to Mr. Richard Baxter. Modestly accepting the challenge by him made in his Sermon of repentance, preached before the Honorable House of Commons, 30 April, 1660.",Anonymous,s n,London," Early works to 1800. -- Church and state -- Religion and state --  England --  Sermon of repentance -- Baxter, Richard, 1615-1691.",1660
A90702,R22392,P2222,"The sharpnesse of the svvord: or, Abners plea for accommodation. A sermon lately preached by John Pigot, curate of St Sepulchres, London.","Pigot, John.",Printed for John Clark and are to be sold at his shop under S Peters Church in Corn hill,London," 17th century. -- Great Britain --  Early works to 1800. --  Sermons --  O.T. --  Sermons. -- Sermons, English --  History --  Civil War, 1642-1649 --  Samuel, 2nd, II, 26 -- Bible.",1643
A96864,R210371,W3414,"Divine poems being meditations upon several sermons, preached at Eckington in the county of Darbie / by Mr. S.G. And put into vers by William Wood of Eckington, Gent.","Wood, William.; S. G.",Printed by Will Du Gard for the author,London, Early works to 1800. -- Christian life --  Poetry,1655
A93332,R184282,S4004,"A reply to a pamphlet called, Oaths no gospel-ordinance, &c. Wherein a sermon preached at Carlisle, Aug. 17. 1664. with all the arguments therein produced (to prove that our Saviour did not forbid all swearing) is fully vindicated ... / By Alan Smalwood ...","Smallwood, Allan, 1608-1686.; Howgill, Francis, 1618-1669. Oaths no gospel ordinance but prohibited by Christ.",Printed by Stephen Bulkley and are to be sold by Francis Mawbarne,York," Early works to 1800. -- Society of Friends --  England -- Oaths --  Moral and ethical aspects --  Sermon preached at Carlisle, Aug. 17, 1664. --  Doctrines -- Smallwood, Allan, 1608-1686.",1667
A90476,R203151,P1502,"A perfect narrative of the late proceedings of the Parliament of Scotland, in relation to the affaires of England. Also the manner of the funerall of the Right Honourable, Ferdinando Lord Fairfax : with the chief heads of his Lordships funerall-sermon, preached by Mr. Bowles. 15. March instant. And sundry other particulars concerning the L. Widdringdon, Sir Thomas Glemham, Sir Charles Lucas, and others late going into Scotland.","Bowles, Edward, 1613-1662.",Printed by Robert Austin,London," 1625-1649 --  Early works to 1800. --  Baron, 1584-1648 -- Fairfax, Ferdinando Fairfax, --  Politics and government -- Scotland --  Death and burial",1648
A95939,R200964,V472,"A vindication of certaine citizens that lately went to the leaguer, then before Oxford, or, Their answer to some prevaricating passages, inserted in an epistle, lately published by William Dell, minister of the Gospel. Occasioned, by their attesting his delivering of certain positions, in a sermon at the leaguer, here set down, they being thereunto called by the House of Lords. Published by authoritie.",Anonymous,Printed by Eliz Purslow for Thomas Vere at the upper end of the Old baily,London," Early works to 1800. -- Church and state -- Great Britain --  Building and glory of the truely Christian and spiritual church. --  Church history --  England -- Dell, William, d. 1664. --  17th century",1646
A79568,R223892,C3994eA,"The church defended, against Mr. Skingle's assize-sermon at Hertford In a letter to a friend. By a true lover of the orthodox clergie.",True lover of the orthodox clergie.,s n,London,"Assize sermons --  Early works to 1800. --  17th century. --  Reformation and union recommended, as the present duty and interest of the nation -- Skingle, Richard. --  Controversial literature",1699
A73832,S125208,6935.5,"A briefe dialogue, concerning preparation for the worthy receiuing of the Lords Supper. Taken, for the most part, out of the ten sermons of Mr I. Dod, and Mr. R. Cleaver, touching that subiect","Dod, John, 1549?-1645. Ten sermons tending chiefely to the fitting of men for the worthy receiving of the Lords Supper.; Dod, John, 1549?-1645.; Cleaver, Robert, 1561 or 2-ca. 1625. aut",printed by I B eale for Roger Iackson and are to be sold at his shop neere Fleete Conduit,London," Early works to 1800. -- Lord's Supper -- Sermons, English --  17th century.",1614
A77100,R206793,B3760,"Paideia Thriamous. The triumph of learning over ignorance, and of truth over faleshood. Being an answer to foure quæries. Whether there be any need of universities? Who is to be accounted an hæretick? Whether it be lawfull to use coventicles? Whether a lay-man may preach? VVhich were lately proposed by a zelot, in the parish church at Swacie neere Cambridge, after the second sermon, October 3. 1652. Since that enlarged by the answerer, R.B. B.D. and fellow of Trin. Col. Camb.","R. B. (Robert Boreman), d. 1675.",printed by R Royston at the Angel in Ivie lane,London, Early works to 1800. -- Religion --  Controversial literature,1652
A63877,R38378,T3277,"A letter to the clergy of the diœcess of Ely from the Bishop of Ely ; before, and preparatory to his visitation.","Turner, Francis, 1638?-1700.; Church of England. Diocese of Ely. Bishop (1684-1690 : Turner)",Printed by J Hayes,Cambridge Cambridgeshire,"Church of England -- Visitation sermons. --  Pastoral letters and charges. -- Theology, Practical.",1686
A62992,R222359,T1957B,"A letter to Mr. Mead, in answer to several unscriptural, and unsound sayings of his in a sermon against the seventh-day-sabbath, preached at his place of meeting, the twenty third of the second month. 1682. Wrote the same day the sermon was preached, refuting his arguments, and turning them back, making their unskilfulness and weakness manifest; and clearly evidencing, that the seventh-day is the sabbath day; by clear scripture-testimony, and sound arguments grounded thereon. Published for his hearers, because he would neither hear an objection in publick, nor admit of a conference in private.","Tovey, W.",printed for the author and are to be sold by John Lawrence at the Angel in Cornhil near the Royal Exchange,London, Early works to 1800. -- Sabbath,1682
A67411,R34712,W607A,"Theological discourses, in two parts the first containing VIII letters and III sermons concerning the blessed Trinity : the second, discourses & sermons on several occasions / by John Wallis ...","Wallis, John, 1616-1703.",Printed for Tho Parkhurst,London,"Theology, Doctrinal. --  17th century. -- Trinity. -- Sermons, English",1695
A60864,R18529,S4616,"Some short remarks upon a book, entituled, An answer (but is none) to Dr. Stillingfleet's sermon, by some nonconformists in a letter to his friend in London from a person of quality in the country.",Anonymous,Printed for Randall Taylor,London,"Humfrey, John, 1621-1719. -- Dissenters, Religious --  Answer to Dr. Stillingfleet's book of the unreasonableness of separation. --  England.",1680
A64639,R23555,U17,"Perez Uzza, Or, A serious letter sent to Master Edm. Calamy, January the 17th, 1663 touching his sermon at Aldermanbvry, December the 28th, intimating his close design, and dangerous insinuation against the publick peace : with some queries he is to answer, for the satisfaction of the world.","Udall, O.",Printed for George Bisaker,London," Eli trembling for fear of the Ark. -- Calamy, Edmund, 1600-1666.",1663
A64197,R219145,T4E,"Diotrephes detected, corrected, and rejected, and Archippus admonished: by a soft answer to an angry sermon and book lately published, intituled, A true account of what was done, at the casting of two members out of Mr. Stucleys congregation in Exon",E. T.,printed by M S for Henry Cripps and are to be sold at his shop in Popes Head Alley,London," Early works to 1800. -- Dissenters, Religious --  True account of what was done by a Church of Christ in Exon --  England -- Mall, Thomas, b. 1629 or 30. -- Excommunication",1658
A61683,R222081,S5743,"A letter sent to a friend containing some reflections upon a late book intituled, The Roman church vindicated, and M.S. convicted of a false witnesse against her Wherein is declar'd, that the Pope may excommunicate and depose Kings according to the judgement of their greatest doctors, decrees and practices of several Popes, and Canons of their most approved councils; and the author convicted of most notorious falsities, &c. By J.S. B.D.","Stopford, Joshua, 1636-1675.",s n,London,Anti-Catholicism --  Early works to 1800. --  Sermons --  England -- Catholic Church --  Controversial literature,1675
A48191,R27642,L1676,"A Letter to a member of Parliament now in the country upon the occasion of the sermon preached before the Honourable the House of Commons at St. Margaret's Westminster, Jan. 30th, and lately publish'd which letter is contained a just and seasonable and too necessary vindication of K. Charles I, and of all the kings of England that ever were before him or shall be after him and of the English monarchy.",Anonymous,Printed and sold by John Nutt,London,Great Britain --  1642-1649. --  Kings and rulers. --  Politics and government,1700
A43685,R6402,H1878,"A vindication of some among our selves against the false principles of Dr. Sherlock in a letter to the doctor, occasioned by the sermon which he preached at the Temple-Church on the 29th of May, 1692 : in which letter are also contained reflexions on some other of the doctor's sermons, published since he took the oath.","Hickes, George, 1642-1715.",s n,London," Early works to 1800. -- Sherlock, William, 1641?-1707. -- Divine right of kings --  Sermon preached at the Temple-Church, May 29, 1692.",1692
A43806,R5805,H2011,"The rites of the Christian church further defended in answer to the appeal of Dr. Wake : with a letter to Mr. Hill ... on the account of the Municipium ecclesiasticum, as also an answer / by Sam. Hill ...","Hill, Samuel, 1648-1716.; N. N.",Sold by the book sellers of London and Westminster,London," Municipium ecclesiasticum. --  1690. -- Hill, Samuel, 1648-1716. --  Sermons. --  Selections. -- Wake, William, 1657-1737.",1698
A46883,R220740,J743,"The Jewes message to their brethern in Holland; and a new letter touching their further proceedings sent from the kingdom of Scotland: with the arrive [sic] of some of them near Aberdeen, in a small ship, whose sails were white cranched sattin, their ropes and tackling silk of the sames colour; and their food on board only rice and pure honey. Also, another letter from Dr. Serarias, to doctor Homes; the rendovouzing of sexteen hundred thousand in the Turks dominions; and threescore thousand come into Europe; the Great Turks sad and fearful dream; and strange miracles performed by the Captain-general of the wandring Israelites; a description of their persons, habits, and weapons; the granting of liberty of conscience to all excepting infidels; a prophecie touching the downfal of Babylon in 66, and the year of reformation for the Gospel to be preached throughout all nations.",Anonymous,printed for George Freeman,London, Early works to 1800. -- Turkey --  Turkey -- Jews --  Ethnic relations --  History,1665
A40538,R26736,F2275A,"A Full and certain relation concerning the horrid plot of the papists and the barbarous and bloody murther of Sr. Edmund Bury Godfrey, one of His Majesties justices of the peace ... with an exact account in what manner he was found and what wounds he had on his body : together with the most noble manner of his being buried and the text of the sermon there preached ...",Anonymous,Printed for Lawrence White,London,"Popish Plot, 1678. --  Sir, 1621-1678. -- Godfrey, Edmund Berry,",1678
A41496,R37400,G1182,"Moses made angry, or, A letter written and sent to Dr. Hill, master of Trinity Colledg in Cambridg upon occasion of some hard passages that fell from him in a sermon preached at Pauls, May 4, 1651 / by John Goodwin.","Goodwin, John, 1594?-1665.",Printed by J M for Henry Cripps and Lodowick Lloyd,London," Redemption redeemed. -- Hill, Thomas, d. 1653. -- Goodwin, John, 1594?-1665. -- Redemption. -- Theology, Doctrinal.",1651
A45149,R5169,H3700,"Peace at Pinners-Hall wish'd, and attempted in a pacifick paper touching the universality of redemption, the conditionality of the covenant of grace, and our freedom from the law of works upon occasion of a sermon ... / by a lover of truth and accommodation.","Humfrey, John, 1621-1719.",Printed and are to be sold by Randal Taylor,London,Redemption. -- Grace (Theology),1692
A48968,R224117,L2844A,"The Lombard-Street lecturer's late farewell sermon, answer'd: or, the Welsh Levite toss'd de novo A dialogue between David J-nes and Dr. John Bastwick; and lovewit and fairman, two of his late parishioners. Addressed to the banker of Lombard-Street.",Anonymous,printed for the assigns of John Bastwick and sold by T J without Temple Barr,London,"Bastwick, John, 1593-1654 --  Early works to 1800. -- Jones, David, 1663-1724? --  Farewel-sermon preached to the united parishes of St. Mary Woolnoth, & St. Mary Woolchurch-Haw in Lombard-Street",1692
A56791,R1660,P961,"Jesus is God, or, The deity of Jesus Christ vindicated being an abstract of some sermons preach'd in the parish-church of St. James, Clerkenwell / by D. Pead.","Pead, Deuel, d. 1727.",Printed for George Conyers and Will Newton,London," 17th century. --  Divinity --  Sermons. -- Jesus Christ -- Sermons, English",1694
A55289,R17446,P2736,A Poetical essay devoted to the glorious memory of our late queen occasion'd by a number of poems and sermons upon her death.,Anonymous,s n,London,"Mary --  Poetry. --  II, --  Queen of England, 1662-1694",1695
A54939,R7270,P2307,"A letter from Moses Pitt, to the authour of a book, intituled, some discourses upon Dr. Burnet, now Ld. Bp. of Salisbury and Dr. Tillotson, late Ld. A.B. of Canterbury occasioned by the late funeral sermon of the former upon the latter.","Hickes, George, 1642-1715.; Pitt, Moses, fl. 1654-1696.; Tillotson, John, 1630-1694.",Printed for Moses Pitt,London,"Burnet, Gilbert, 1643-1715. --  Sermon preached at the funeral of ... John ... Lord Archbishop of Canterbury.",1695
A57258,R214217,R142B,"Dr. Reignolds his letter to that worthy councellor, Sir Francis Knolles concerning some passages in Dr. Bancrofts sermon at Pavles Crosse, Feb. 9. 1588. in the Parliament time. As also A qvestion resolved by a learned doctor, whether the angels of the seaven churches, Revel. 2, & 3. make for Episcopall præ-eminence Jure Divino.","Rainolds, John, 1549-1607.",printed by W I dweling in Red crosse Street,London," Early works to 1800. -- Episcopacy --  Sir, d. 1643 -- Knollys, Francis, --  Sermon preached at Paules Crosse the 9. of Februarie -- Bancroft, Richard, 1544-1610. -- Church polity",1641
A56278,R28464,P4203,"Pulpit sparks, or, Choice forms of prayer by several reverend and godly divines ; used by them both before and after sermons ; with other prayers for extraordinary occasions ; together with Dr. Hewytt's last prayer.","Hewit, John, 1614-1658.",Printed for W Gilbertson,London,Prayers.,1659
A58892,R37197,S218,"A letter to a peer of the Church of England clearing a point touched in a sermon preached at Chester, before His Most Sacred Majesty, on the 28th of August, in answer to a post-script joyned unto the answer to Nubes testium.","Sabran, Lewis, 1652-1732.",Printed by Henry Hills,London,"Authority --  Answer to the compiler of the Nubes testium. --  Religious aspects. -- Gee, Edward, 1657-1730. -- Catholic Church --  Apologetic works.",1687
A16497,S106544,3410,"God and man. Or, a treatise catechisticall wherein the sauing knowledge of God and man is plainely, and breifely declared, whereby such as are ignorant may be helped, to heare sermons with profit, to reade the Bible or other bookes with iudgement, to receiue the Lords Supper with comfort, to discerne betweene truth and error, with vnderstanding, and to giue an answere to their minister, or any other that shall aske them a reason of their faith, with readinesse. Collected out of the sacred Scriptures, and the most orthodoxe and best approued diuines ancient and moderne, for the good of such as desire to be made wise to saluation, and heires of eternall life. By I.B. preacher of the Word.","Boughton, John, preacher of the word.",Printed by N icholas O kes for Samuel Man and are to be sold at his shop in Paules Church yard at the signe of the Swanne,London,Church of England --  English. --  Catechisms,1623
A18267,S4581,4884.5,"A table alphabeticall contayning and teaching the true writing and vnderstanding of hard vsuall English wordes, borrowed from the Hebrew, Greeke, Latine, or French &c. : with the interpretation thereof by plaine English words, gathered for the benefit and help of all vnskilfull persons : whereby they may the more easily and better vnderstand many hard English words, which they shall heare or read in Scriptures, sermons, or elsewhere, and also be made able to vse the same aptly themselues / set foorth by R.C. ; and newly corrected, and much inlarged by T.C.","Cawdry, Robert.; T. C.",Printed by T S for Edmund Weauer and are to be sold at his shop at the great north dore of Paules Church,London,English language --  Early works to 1700. --  Dictionaries,1609
A03696,S104236,13823,"Of the rich man and Lazarus Certaine sermons, by Robert Horne.","Horne, Robert, 1565-1640.",Printed by Ber Alsop for Iohn Hodgets,London," 17th century. -- Sermons, English",1619
A06013,S102042,1640,"The diocesans tryall Wherein all the sinnews of D. Dovvnames Defence are brought unto three heads, and orderly dissolved. By M. Paul Baynes.","Baynes, Paul, d. 1617.",Imprinted by G Thorp,Amsterdam," Early works to 1800. --  Defence of the sermon preached at the consecration of the L. Bishop of Bath and Welles, against a confutation thereof by a namelesse author -- Church of England -- Downame, George, d. 1634. --  Government --  Controversial literature",1618
